Federal Express is now called FedEx. When I retire I'll be a FedEx ex. But if I'm an officer when I retire, I'll be an ex Fedex Exec. Then after a divorce, my ex-wife will be an ex FedEx exec's ex. If I rejoin FedEx in time, I'd be an ex ex FedEx exec. When we remarry, my wife will be an ex ex FedEx exec's ex.,,,,,,,,,,,,,,,
Few free fruit flies fly from flames.,,,,,,,,,,,,,,,,,,,
Five fat friars frying flat fish.,,,,,,,,,,,,,,,,,,,
Five frantic frogs fled from fifty fierce fishes.,,,,,,,,,,,,,,,,,,,
Five fuzzy French frogs Frolicked through the fields in France.,,,,,,,,,,,,,,,,,,,
Flash message!,,,,,,,,,,,,,,,,,,,
Flee from fog to fight flu fast!,,,,,,,,,,,,,,,,,,,
Flies fly but a fly flies.,,,,,,,,,,,,,,,,,,,
Four free-flow pipes flow freely.,,,,,,,,,,,,,,,,,,,
Four furious friends fought for the phone.,,,,,,,,,,,,,,,,,,,
Four poor fools filled four pools full.,,,,,,,,,,,,,,,,,,,
Fran feeds fish fresh fish food.,,,,,,,,,,,,,,,,,,,
Frank?ôs peers pranks feared.,,,,,,,,,,,,,,,,,,,
Frank's fisher fishes on Friday for Frank's Friday fresh fried fish-fest.,,,,,,,,,,,,,,,,,,,
Freckle-faced Freddie fidgets.,,,,,,,,,,,,,,,,,,,
Fred fed Ted bread, and Ted fed Fred bread.,,,,,,,,,,,,,,,,,,
Fred Threlfall?ôs thirty-five fine threads are finer threads than Fred Threlfall?ôs thirty-five thick threads.,,,,,,,,,,,,,,,,,,,
Fred Threlfall's thirty-five fine threads are finer threads than Fred Threlfall's thirty-five thick threads.,,,,,,,,,,,,,,,,,,,
Freddy is ready to roast red roaches. Ready for Freddy's roasted red roaches?,,,,,,,,,,,,,,,,,,,
Free Ritz wristwatch.Try saying Ritz wristwatch 5 times fast!,,,,,,,,,,,,,,,,,,,
Fresh fish and fried prawns,,,,,,,,,,,,,,,,,,,
Fresh French fried fly fritters,,,,,,,,,,,,,,,,,,,
Fresh fried fish, Fish fresh fried, Fried fish fresh, Fish fried fresh.,,,,,,,,,,,,,,,,
Fresh fried fish, Fish fresh fried, Fried fish fresh, Fish fried fresh I tried.,,,,,,,,,,,,,,,,
Freshly fried flying fish, freshly fried flesh.,,,,,,,,,,,,,,,,,,
Freshly fried fresh flesh,,,,,,,,,,,,,,,,,,,
Friendly Frank flips fine flapjacks.,,,,,,,,,,,,,,,,,,,
Friskies frisbee,,,,,,,,,,,,,,,,,,,
Frogfeet, flippers, swimfins.,,,,,,,,,,,,,,,,,
From a slap dash flash cash haberdash shop. ,,,,,,,,,,,,,,,,,,,
From the programmer's desk: She sells cshs by the C shore.,,,,,,,,,,,,,,,,,,,
Frozen Floyd flicks fat fleas for a fixed flat fee.,,,,,,,,,,,,,,,,,,,
Furnish Freddie's nursery with forty-four furry Furby Beanie Babies.,,,,,,,,,,,,,,,,,,,
Fuzzy Wuzzy was a bear, Fuzzy Wuzzy had no hair, Fuzzy Wuzzy wasn't very fuzzy, was he?,,,,,,,,,,,,,,,,
Fuzzy Wuzzy was a bear. Fuzzy Wuzzy had no hair. Fuzzy Wuzzy wasn?ôt fuzzy, was he?,,,,,,,,,,,,,,,,,,
Gail?ôs maid mailed jade.,,,,,,,,,,,,,,,,,,,
Gale?ôs great glass globe glows green.,,,,,,,,,,,,,,,,,,,
Gertie?ôs great-grandma grew aghast at Gertie?ôs grammar.,,,,,,,,,,,,,,,,,,,
Giddy kiddy goat, Giddy kiddy goat, Giddy, giddy, giddy, giddy, giddy, kiddy goat.,,,,,,,,,,,,
Gig whip, gig whip, gig whip, ...,,,,,,,,,,,,,,,,
Girl gargoyle, guy gargoyle.,,,,,,,,,,,,,,,,,,
Give me the gift of a grip-top sock, a clip drape shipshape tip top sock. Not your spinslick slapstick slipshod stock, but a plastic, elastic grip-top sock. None of your fantastic slack swap slop,,,,,,,,,,,,,,,,
Give me the gift of a griptop sock: a drip-drape, ship-shape, tip-top sock.,,,,,,,,,,,,,,,,,
Give Mr. Snipe?ôs wife?ôs knife a swipe.,,,,,,,,,,,,,,,,,,,
Give papa a cup of proper coffee in a copper coffee cup.,,,,,,,,,,,,,,,,,,,
Gobbling gorgoyles gobbled gobbling goblins.,,,,,,,,,,,,,,,,,,,
Good blood, bad blood, good blood, bad blood, good blood, bad blood.,,,,,,,,,,,,,,
Grandma Gabby Grammer grabbed a gram of gummy goulash. If Grandma Gabby Grammer grabbed a gram of gummy goulash, how many grams of gummy goulash did Grandma Gabby Grammer grab?,,,,,,,,,,,,,,,,,,
Great Gate Crasher,,,,,,,,,,,,,,,,,,,
Great glass globes gleam green.,,,,,,,,,,,,,,,,,,,
Great gray gaping grape grates.,,,,,,,,,,,,,,,,,,,
Great gray goats,,,,,,,,,,,,,,,,,,,
Greek grapes.,,,,,,,,,,,,,,,,,,,
Green and brown blades of grass,,,,,,,,,,,,,,,,,,,
Green glass globes glow greenly.,,,,,,,,,,,,,,,,,,,
Grip glue, grip glue, grip glue, ...,,,,,,,,,,,,,,,,
Gus goes by Blue Goose bus.,,,,,,,,,,,,,,,,,,,
Hassock hassock, black spotted hassock. Black spot on a black back of a black spotted hassock.,,,,,,,,,,,,,,,,,,
Hawk hugs the hedgehog,,,,,,,,,,,,,,,,,,,
He threw three balls.,,,,,,,,,,,,,,,,,,,
He threw three free throws.,,,,,,,,,,,,,,,,,,,
"He thrusts his fists against the posts, and still insists he sees the ghosts.",,,,,,,,,,,,,,,,,,,
He wanted to desert his dessert in the desert!,,,,,,,,,,,,,,,,,,,
Her whole right hand really hurts.,,,,,,,,,,,,,,,,,,,
Hercules, a hardy hunter, hunted a hare in the Hampshire Hills. Hit him on the head with a hard, hard hammer and he howled horribly!,,,,,,,,,,,,,,,,
Hiccup teacup!,,,,,,,,,,,,,,,,,,,
Higgledy-Piggedly!,,,,,,,,,,,,,,,,,,,
Hitchcock Hawk Watch Spots Record Raptors,,,,,,,,,,,,,,,,,,,
Hi-Tech Traveling Tractor Trailor Truck Tracker.,,,,,,,,,,,,,,,,,,,
How can a clam cram in a clean cream can?,,,,,,,,,,,,,,,,,,,
How many bears could Bear Grills grill if Bear grills could grill bears?,,,,,,,,,,,,,,,,,,,
How many berries could a bare berry carry, if a bare berry could carry berries? Well they can't carry berries (which could make you very wary) but a bare berry carried is more scary!,,,,,,,,,,,,,,,,,,
How many berries could a bare berry carry, if a bare berry could carry berries? Well they can?ôt carry berries (which could make you very wary) but a bare berry carried is more scary!,,,,,,,,,,,,,,,,,,
How many boards Could the Mongols hoard If the Mongol hoards got bored?,,,,,,,,,,,,,,,,,,,
How many boards could the Mongols hoard if the Mongol hordes got bored?,,,,,,,,,,,,,,,,,,,
How many cans can a canner can if a canner can can cans? A canner can can as many cans as a canner can if a canner can can cans.,,,,,,,,,,,,,,,,,,,
How many cans can a cannibal nibble if a cannibal can nibble cans? As many cans as a cannibal can nibble if a cannibal can nibble cans.,,,,,,,,,,,,,,,,,,,
How many cookies could a good cook cook If a good cook could cook cookies? A good cook could cook as much cookies as a good cook who could cook cookies.,,,,,,,,,,,,,,,,,,,
How many pounds in a groundhog's mound when a groundhog pounds hog mounds?,,,,,,,,,,,,,,,,,,,
How many rats would the ruskies roast if the ruskies could roast rats? How many cats would a caddie catch if a caddie could catch cats?,,,,,,,,,,,,,,,,,,,
How many sheets could a sheet slitter slit if a sheet slitter could slit sheets?,,,,,,,,,,,,,,,,,,,
How many snacks could a snack stacker stack, if a snack stacker snacked stacked snacks?,,,,,,,,,,,,,,,,,,
How many tow trucks could a tow truck tow if a tow truck could tow tow trucks.,,,,,,,,,,,,,,,,,,,
How many wenches could a witch's wench wrench wrench if a witch's wench wrench could wrench wenches. As many wenches as a witch's wench wrench could, if a witch's wench wrench could wrench wenches.,,,,,,,,,,,,,,,,,,
How many yaks could a yak pack pack if a yak pack could pack yaks?,,,,,,,,,,,,,,,,,,,
How may saws could a see-saw saw if a see-saw could saw saws?,,,,,,,,,,,,,,,,,,,
How much caramel can a canny canonball cram in a camel if a canny canonball can cram caramel in a camel?,,,,,,,,,,,,,,,,,,,
How much cash could a sasquatch stash if a sasquatch could stash cash?,,,,,,,,,,,,,,,,,,,
How much dew does a dewdrop drop If dewdrops do drop dew? They do drop, they do As do dewdrops drop If dewdrops do drop dew.,,,,,,,,,,,,,,,,,,
How much dough would Bob Dole dole if Bob Dole could dole dough? Bob Dole would dole as much dough as Bob Dole could dole, if Bob Dole could dole dough.,,,,,,,,,,,,,,,,,,
How much ground could a grounghog grind if a groundhog could grind ground?,,,,,,,,,,,,,,,,,,,
How much ground would a groundhog hog, if a groundhog could hog ground? A groundhog would hog all the ground he could hog, if a groundhog could hog ground.,,,,,,,,,,,,,,,,,
How much juice does a fruit juice producer produce when a fruit juice producer produces fruit juice? We can deduce a fruit juice produces as much juice as a fruit juice produce can seduce from the fruit that produces juice.,,,,,,,,,,,,,,,,,,,
How much myrtle would a wood turtle hurdle if a wood turtle could hurdle myrtle? A wood turtle would hurdle as much myrtle as a wood turtle could hurdle if a wood turtle could hurdle myrtle.,,,,,,,,,,,,,,,,,,,
How much oil boil can a gum boil boil if a gum boil can boil oil?,,,,,,,,,,,,,,,,,,,
How much pot, could a pot roast roast, if a pot roast could roast pot.,,,,,,,,,,,,,,,,,
How much snus could a moose on the loose use if a moose on the loose could use loose snus?,,,,,,,,,,,,,,,,,,,
How much squash could a sasquatch squish, if a sasquatch could squish squash?,,,,,,,,,,,,,,,,,,
How much web would a web browser browse, if a web browser could browse web?,,,,,,,,,,,,,,,,,,
How much wood could Chuck Woods' woodchuck chuck, if Chuck Woods' woodchuck could and would chuck wood? If Chuck Woods' woodchuck could and would chuck wood, how much wood could and would Chuck Woods' woodchuck chuck? Chuck Woods' woodchuck would chuck, he would, as much as he could, and chuck as much wood as any woodchuck would, if a woodchuck could and would chuck wood.,,,,,,,,,,,,,
How much wood would a woodchuck chuck, If a woodchuck could chuck wood? He would chuck, he would, as much as he could, And chuck as much as a woodchuck wouldIf a woodchuck could chuck wood.,,,,,,,,,,,,,,,
How much wood would a woodchuck chuck if a woodchuck would  chuck wood? A woodchuck would chuck how much a woodchuck would chuck if a  woodchuck would chuck wood.,,,,,,,,,,,,,,,,,,,
How much Zen would a Zen master master if Zen master could master all the Zen? A Zen master would master all the Zen he could master if a Zen master should master all the Zen,,,,,,,,,,,,,,,,,,,
Hulk Hawk is hulking the hawk, Hawk Hulk is hawking Hulk ... ,,,,,,,,,,,,,,,,,,
Hum-min-a, Hum-min-a, Hum-min-a, ...,,,,,,,,,,,,,,,,
I am a mother pheasant plucker, I pluck mother pheasants. I am the best mother pheasant plucker, that ever plucked a mother pheasant!,,,,,,,,,,,,,,,,,
I am not a pheasant plucker, I'm a pheasant plucker's son but I'll be plucking pheasants when the pheasant plucker's gone.,,,,,,,,,,,,,,,,,,
I am not a pheasant plucker, I?ôm a pheasant plucker?ôs son but I?ôll be plucking pheasants When the pheasant plucker?ôs gone.,,,,,,,,,,,,,,,,,,
I am not the pheasant plucker, I'm the pheasant plucker's mate. I am only plucking pheasants 'cause the pheasant plucker's late.,,,,,,,,,,,,,,,,,,
I bought a bit of baking powder and baked a batch of biscuits. I brought a big basket of biscuits back to the bakery and baked a basket of big biscuits. Then I took the big basket of biscuits and the basket of big biscuits and mixed the big biscuits with the basket of biscuits that was next to the big basket and put a bunch of biscuits from the basket into a biscuit mixer and brought the basket of biscuits and the box of mixed biscuits and the biscuit mixer to the bakery and opened a tin of sardines.,,,,,,,,,,,,,,,,,,,
I bought a bit of baking powder and baked a batch of biscuits. I brought a big basket of biscuits back to the bakery and baked a basket of big biscuits. Then I took the big basket of biscuits and the basket of big biscuits and mixed the big biscuits with the basket of biscuits that was next to the big basket and put a bunch of biscuits from the basket into a biscuit mixer and brought the basket of biscuits and the box of mixed biscuits and the biscuit mixer to the bakery and opened a tin of sardines.,,,,,,,,,,,,,,,,,,,
I bought a box of biscuits, a box of mixed biscuits, and a biscuit mixer.,,,,,,,,,,,,,,,,,
I broke a brickbat and a brickbat broke me.,,,,,,,,,,,,,,,,,,,
I can think of six thin things and of six thick things too.,,,,,,,,,,,,,,,,,,,
I cannot bear to see a bear Bear down upon a hare. When bare of hair he strips the hare, Right there I cry, ?úForbear!??,,,,,,,,,,,,,,,,,
"I can't believe that ""I Can't Believe It's Not Butter!"" is actually a butter that I can't believe is not butter.",,,,,,,,,,,,,,,,,,,
I correctly recollect Rebecca MacGregor?ôs reckoning.,,,,,,,,,,,,,,,,,,,
I eat eel while you peel eel.,,,,,,,,,,,,,,,,,,,
I feel a feel a funny feel a funny feel feel I, if I feel a funny feel a funny feel feel I.,,,,,,,,,,,,,,,,,,
I gratefully gazed at the gracefully grazing gazelles.,,,,,,,,,,,,,,,,,,,
I know a boy named Tate who dined with his girl at eight eight. I?ôm unable to state what Tate ate at eight eight or what Tate?ôs tte tte ate at eight eight.,,,,,,,,,,,,,,,,,,,
I miss my Swiss Miss. My Swiss Miss misses me.,,,,,,,,,,,,,,,,,,,
I need not your needles, they?ôre needless to me; For kneading of noodles, ?ôtwere needless, you see; But did my neat knickers but need to be kneed, I then should have need of your needles indeed. Flee from fog to fight flu fast!,,,,,,,,,,,,,,,
I saw a kitten eating chicken in the kitchen.,,,,,,,,,,,,,,,,,,,
I saw a saw in Arkansas, that would outsaw any saw I ever saw, and if you got a saw that will outsaw the saw I saw in Arkansas let me see your saw.,,,,,,,,,,,,,,,,,
I saw a saw in Warsaw. Of all the saws I ever saw I never saw a saw that could saw, like the saw I saw in Warsaw.,,,,,,,,,,,,,,,,,,
I saw Esau kissing Kate. I saw Esau, he saw me, and she saw I saw Esau.,,,,,,,,,,,,,,,,,
I saw Esau sitting on a seesaw. I saw Esau; he saw me.,,,,,,,,,,,,,,,,,,,
I saw Susie sitting in a shoe shine shop. ,,,,,,,,,,,,,,,,,,,
I saw Susie sitting in a shoe shine shop. Where she sits she shines, and where she shines she sits.,,,,,,,,,,,,,,,,,,
I scream, you scream, we all scream for icecream!,,,,,,,,,,,,,,,,,
I see a sea down by the seashore. But which sea do you see down by the seashore?,,,,,,,,,,,,,,,,,,,
I see he sees high seas she sees.,,,,,,,,,,,,,,,,,,,
I see Isis?ôs icy eyes.,,,,,,,,,,,,,,,,,,,
I shot a hippopotamus with bullets made of platinum because if I used leaden ones his hide would surely flatten them.,,,,,,,,,,,,,,,,,,,
I shot the city sheriff,,,,,,,,,,,,,,,,,,,
I shot the city sheriff. I shot the city sheriff. I shot the city sheriff.,,,,,,,,,,,,,,,,,,,
I shot three shy thrushes.,,,,,,,,,,,,,,,,,,,
I slit a sheet, a sheet I slit, upon a slitted sheet I sit.,,,,,,,,,,,,,,,,,
I slit a sheet, a sheet I slit, and on that slitted sheet I sit.,,,,,,,,,,,,,,,,,
I slit the sheet, the sheet I slit. Upon the slitted sheet I sit.,,,,,,,,,,,,,,,,,,
I stood sadly on the silver steps of Burgess's fish sauce shop, mimicking him hiccuping, and wildly welcoming him within.,,,,,,,,,,,,,,,,,
I thought, I thought of thinking of thanking you.,,,,,,,,,,,,,,,,,,
I thought a thought. But the thought I thought wasn?ôt the thought I thought I thought. If the thought I thought I thought had been the thought I thought, I wouldn?ôt have thought so much.,,,,,,,,,,,,,,,,,,
I thought a thought. But the thought I thought Wasn't the thought I thought I thought. If the thought I thought I thought,Had been the thought I thought, I wouldn't have thought I thought.,,,,,,,,,,,,,,,,,
I thought the haughty Professor Tortoise taught ontology, but the naughty Tortoise taught us tautology.,,,,,,,,,,,,,,,,,,
I was born on a pirate ship.,,,,,,,,,,,,,,,,,,,
I wish I were what I was when I wished I were what I am.,,,,,,,,,,,,,,,,,,,
I wish to wash my Irish wristwatch.,,,,,,,,,,,,,,,,,,,
I wish to wish, I dream to dream, I try to try, and I live to live, and I?ôd die to die, and I cry to cry but I dont know why.,,,,,,,,,,,,,,
I wish to wish the wish you wish to wish, but if you wish the wish the witch wishes, I won't wish the wish you wish to wish.,,,,,,,,,,,,,,,,,
I wish to wish the wish you wish to wish, but if you wish the wish the witch wishes, I won?ôt wish the wish you wish to wish.,,,,,,,,,,,,,,,,,
I wish you were a fish in my dish.,,,,,,,,,,,,,,,,,,,
I would if I could, and if I couldn?ôt, how could I? You couldn?ôt, unless you could, could you?,,,,,,,,,,,,,,,
I would if I could! But I can?ôt, so I won?ôt!,,,,,,,,,,,,,,,,,,
I would if I could! But I can't, so I won't!,,,,,,,,,,,,,,,,,,
I?ôll chew and chew until my jaws drop.,,,,,,,,,,,,,,,,,,,
I?ôm a sheet slitter. I slit sheets. I am the best sheet slitter that ever slit a sheet.,,,,,,,,,,,,,,,,,,,
I?ôm a sock cutter and I cut socks,,,,,,,,,,,,,,,,,,,
I?ôm not a fig plucker nor a fig plucker?ôs son, but I?ôll pluck your fig?ôs ?ôtil the fig plucker comes.,,,,,,,,,,,,,,,,,,
I?ôm not the fig plucker, Nor the fig plucker?ôs son, but I?ôll pluck your figs till the fig plucker comes.,,,,,,,,,,,,,,,,,
I?ôm not the pheasant plucker, I?ôm the pheasant plucker?ôs mate, And I?ôm only plucking pheasants ?ôcause the pheasant plucker?ôs late. I?ôm not the pheasant plucker, I?ôm the pheasant plucker?ôs son, And I?ôm only plucking pheasants till the pheasant pluckers come.,,,,,,,,,,,,,,,
If a dog chews shoes, whose shoes does he choose?,,,,,,,,,,,,,,,,,,
If a fella met a fella in a field of fitches, can a fella tell a fella where a fella itches?,,,,,,,,,,,,,,,,,,
If a Hottentot taught a Hottentot tot to talk ere the tot could totter, ought the Hottentot tot be taught to say ought or naught or what ought to be taught 'er?,,,,,,,,,,,,,,,,,,
If a Hottentot tot taught a Hottentot tot to talk before the tot would totter, ought the Hottentot tot be taught to say ought, or naught, or what ought to be taught the Hottentot tot? If to hoot and to toot a Hottentot tot be taught by a Hottentot tutor, should the tutor get hot if the Hottentot tot hoots and toots at the Hottentot tutor?,,,,,,,,,,,,,,,
If blue bugs bleed blue blood, and black bugs bleed black blood, do blue-black bugs bleed blue-black blood?,,,,,,,,,,,,,,,,,
If Bob Dole could dole dough? Bob Dole would dole as much dough as Bob Dole could dole, if Bob Dole could dole dough.,,,,,,,,,,,,,,,,,,
If coloured caterpillars could change their colours constantly could they keep their coloured coat coloured properly?,,,,,,,,,,,,,,,,,,,
If Dr. Seuss Were a Technical Writer..... Here's an easy game to play. Here's an easy thing to say: If a packet hits a pocket on a socket on a port, And the bus is interrupted as a very last resort, And the address of the memory makes your floppy disk abort,  Then the socket packet pocket has an error to report! If your cursor finds a menu item followed by a dash, And the double-clicking icon puts your window in the trash, And your data is corrupted 'cause the index doesn't hash, then your situation's hopeless, and your system's gonna crash! You can't say this?  What a shame, sir! We'll find you another game, sir. If the label on the cable on the table at your house, Says the network is connected to the button on your mouse, But your packets want to tunnel on another protocol, That's repeatedly rejected by the printer down the hall, And your screen is all distorted by the side effects of gauss, So your icons in the window are as wavy as a souse, Then you may as well reboot and go out with a bang, 'Cause as sure as I'm a poet, the sucker's gonna hang! When the copy of your floppy's getting sloppy on the disk, And the microcode instructions cause unnecessary risk, Then you have to flash your memory and you'll want to ram your rom. Quickly turn off the computer and be sure to tell your mom!
If he slipped, should she slip?,,,,,,,,,,,,,,,,,,
If I assist a sister-assistant, will the sister?ôs sister-assistant assist me?,,,,,,,,,,,,,,,,,,
If I put it in my batter, it will make my batter bitter!??So she bought a bit of butter better than her bitter butter, And she put it in her batter, and her batter was not bitter. So ?ôtwas better Betty Botter bought a bit of better butter.,,,,,,,,,,,,,,,,
IF IF = THEN THEN THEN = ELSE ELSE ELSE = IF;,,,,,,,,,,,,,,,,,,,
If Kantie can tie a tie and untie a tie, why can't I tie a tie and untie a tie like Kantie can.,,,,,,,,,,,,,,,,,,
If Kantie can tie a tie and untie a tie, why can?ôt I tie a tie and untie a tie like Kantie can.,,,,,,,,,,,,,,,,,,
If Pickford?ôs packers packed a packet of crisps would the packet of crisps that Pickford?ôs packers packed survive for two and a half years?,,,,,,,,,,,,,,,,,,,
If Pickford's packers packed a packet of crisps would the packet of crisps that Pickford's packers packed survive for two and a half years?,,,,,,,,,,,,,,,,,,,
If practice makes perfect and perfect needs practice,I am perfectly practiced and practically perfect.,,,,,,,,,,,,,,,,,,
If Stu chews shoes, should Stu choose the shoes he chews?,,,,,,,,,,,,,,,,,,
If two witches would watch two watches, which witch would watch which watch?,,,,,,,,,,,,,,,,,,
If you can't can any candy can, how many candy cans can a candy canner can if he can can candy cans ?,,,,,,,,,,,,,,,,,,
If you go for a gopher a gopher will go for a gopher hole.,,,,,,,,,,,,,,,,,,,
If you must cross a course cross cow across a crowded cow crossing, cross the cross coarse cow across the crowded cow crossing carefully.,,,,,,,,,,,,,,,,,,
If you notice this notice, you will notice that this notice is not worth noticing.,,,,,,,,,,,,,,,,,,
If you stick a stock of liquor in your locker, it is slick to put a lock upon your stock. For some joker who is quicker will rob you of your liquor if you fail to lock your liquor with a lock.,,,,,,,,,,,,,,,,,,
If you stick a stock of liquor in your locker it is slick to stick a lock upon your stock or some joker who is slicker is going to trick you of your liquor if you fail to lock your liquor with a lock.,,,,,,,,,,,,,,,,,,,
If you understand," say ""understand"". If you don't understand"," say ""don't understand"". But if you understand and say ""don't understand""", how do I understand that you understand. Understand!?,,,,,,,,,,,,,,,,
If you understand, say ?ú‚Äùunderstand?ù‚Ä? If you don?ôt understand, say ?ú‚Äùdon?ôt understand?ù‚Ä? But if you understand and say ?ú‚Äùdon?ôt understand?ù‚Ä? how do I understand that you understand. Understand!?,,,,,,,,,,,,,,,,,
If you?ôre keen on stunning kites and cunning stunts, buy a cunning stunning stunt kite.,,,,,,,,,,,,,,,,,,
If your Bob doesnt give our Bob that bob that your Bob owes our Bob, our Bob will give your Bob a bob in the eye.,,,,,,,,,,,,,,,,,,
If you're keen on stunning kites and cunning stunts, buy a cunning stunning stunt kite.,,,,,,,,,,,,,,,,,,
Ike ships ice chips in ice chips ships.,,,,,,,,,,,,,,,,,,,
I'll chew and chew until my jaws drop.,,,,,,,,,,,,,,,,,,,
I'm a mother pheasant plucker, I pluck mother pheasants. I'm the most pleasant mother pheasant plucker, to ever pluck a mother pheasant. Actually, ... I'm Not the pheasant plucker, I'm the pheasant plucker's son. But I'll stay and pluck the pheasants till the pheasant plucking 's done!,,,,,,,,,,,,,,,
I'm a sheet slitter. I slit sheets. I'm the sleekest sheet slitter that ever slit sheets.,,,,,,,,,,,,,,,,,,,
I'm a sock cutter and I cut socks. I'm a sock cutter and I cut socks. I'm a sock cutter and I cut socks.,,,,,,,,,,,,,,,,,,,
I'm not the fig plucker, nor the fig plucker's son, but I'll pluck figs till the fig plucker comes.,,,,,,,,,,,,,,,,,
Imagine, imagining imagining, an imaginary imaginary imaginary menagerie manager, imagining imagining imagining an imaginary imaginary imaginary managerie.,,,,,,,,,,,,,,,,
Imagine an imaginary menagerie manager managing an imaginary menagerie.,,,,,,,,,,,,,,,,,,,
In 'ertford, 'ereford and 'ampshire, 'urricanes 'ardly Hever 'appen.,,,,,,,,,,,,,,,,,
In Hertford, Hereford and Hampshire hurricanes hardly ever happen.,,,,,,,,,,,,,,,,,,
In pine tar is. In oak none is. In mud eels are. In clay none is.,,,,,,,,,,,,,,,,,,,
In shoulder surgery some surgeons sew soldiers' shoulders.,,,,,,,,,,,,,,,,,,,
Inchworms itching.,,,,,,,,,,,,,,,,,,,
Iranian Uranium,,,,,,,,,,,,,,,,,,,
Irish wristwatch,,,,,,,,,,,,,,,,,,,
Is a pleasant peasant?ôs pheasant present?,,,,,,,,,,,,,,,,,,,
Is this your sister?ôs sixth zither, sir?,,,,,,,,,,,,,,,,,,
It dawned on Don at dawn.,,,,,,,,,,,,,,,,,,,
It?ôs not the cough that carries you off, it?ôs the coffin they carry you off in!,,,,,,,,,,,,,,,,,,
It's a nice night for a white rice fight.,,,,,,,,,,,,,,,,,,,
It's not the cough that carries you off, it's the coffin they carry you off in!,,,,,,,,,,,,,,,,,,
Jack the jailbird jacked a jeep.,,,,,,,,,,,,,,,,,,,
Jack's nap sack strap snapped.,,,,,,,,,,,,,,,,,,,
Jean Claude Jaquettie, with his jacket on. Jean Claude Jaquettie, with his jacket off. Jean Claude Jaquettie, with his jacket on. Jean Claude Jaquettie, with his jacket off. Jacket on, Jacket off, Jacket on, Jacket off.,,,,,,,,,,,,
John," where Peter had had ""had had"""," had had ""had""; ""had had"" had had his master's approval.",,,,,,,,,,,,,,,,,
John," where Molly had had ""had"""," had had ""had had"". ""Had had "" had had the teachers approval.",,,,,,,,,,,,,,,,,
John, where Molly had had ?úhad?? had had ?úhad had?? ?úHad had??had had the teachers approval,,,,,,,,,,,,,,,,,,
Judicial system.,,,,,,,,,,,,,,,,,,,
June sheep sleep soundly.,,,,,,,,,,,,,,,,,,,
Just think, that sphinx has a sphincter that stinks!,,,,,,,,,,,,,,,,,,
Kanta is a masai girl, she can tie a tie and untie a tie, if kanta can tie a tie and untie a tie, why can?ôt I tie a tie and untie a tie?,,,,,,,,,,,,,,,,
Kanta is a masai girl. She can tie a tie and untie a tie. If Kanta can tie a tie and untie a tie, why can't I tie a tie and untie a tie?,,,,,,,,,,,,,,,,,,
Kantai can tie a tie. If Kantai can tie a tie, why can't I tie a tie like Kantai can tie a tie.,,,,,,,,,,,,,,,,,,
Keenly cleaning copper kettles.,,,,,,,,,,,,,,,,,,,
Ken can ken that Ken's kin can ken Ken's kin's ken.,,,,,,,,,,,,,,,,,,,
Ken Dodd?ôs dad?ôs dog ?òs dead.,,,,,,,,,,,,,,,,,,,
