Ken Dodd's dad's dog 's dead.,,,,,,,,,,,,,,,,,,,
King Thistle stuck a thousand thistles in the thistle of his thumb. A thousand thistles King Thistle stuck in the thistle of his thumb. If King Thistle stuck a thousand thistles in the thistle of his thumb, How many thistles did King Thistle stick in the thistle of his thumb?,,,,,,,,,,,,,,,,,,
King Thistle stuck a thousand thistles in the thistle of his thumb. A thousand thistles King Thistle stuck in the thistle of his thumb. If King Thistle stuck a thousand thistles in the thistle of his thumb, How many thistles did King Thistle stick in the thistle of his thumb?,,,,,,,,,,,,,,,,,,
Kiss her quick, kiss her quicker, kiss her quickest!,,,,,,,,,,,,,,,,,
Knapsack strap.,,,,,,,,,,,,,,,,,,,
Knapsack straps.,,,,,,,,,,,,,,,,,,,
Knife and a fork bottle and a cork that is the way you spell New York. Chicken in the car and the car can go, that is the way you spell Chicago.,,,,,,,,,,,,,,,,,,
Kris Kringle carefully crunched on candy canes.,,,,,,,,,,,,,,,,,,,
Labradoodle, labradoodle, labradoodle, ...,,,,,,,,,,,,,,,,
Lady Luck dislikes losers.,,,,,,,,,,,,,,,,,,,
Larry Hurley, a burly squirrel hurler, hurled a furry squirrel through a curly grill.,,,,,,,,,,,,,,,,,
Larry sent the latter a letter later.,,,,,,,,,,,,,,,,,,,
Lenny Lou leopard led leprechauns leaping like lemmings.,,,,,,,,,,,,,,,,,,,
Lesser weather never weathered lesser wetter weather.,,,,,,,,,,,,,,,,,,,
Lily ladles little Letty?ôs lentil soup.,,,,,,,,,,,,,,,,,,,
Lisa laughed listlessly.,,,,,,,,,,,,,,,,,,,
Listen to the local yokel yodel.,,,,,,,,,,,,,,,,,,,
Literally literary.,,,,,,,,,,,,,,,,,,,
Little Mike left his bike like Tike at Spike?ôs.,,,,,,,,,,,,,,,,,,,
Little Mike left his bike like Tike at Spike's.,,,,,,,,,,,,,,,,,,,
Local yokel jokes.,,,,,,,,,,,,,,,,,,,
Lonely lowland llamas are ladylike.,,,,,,,,,,,,,,,,,,,
Love?ôs a feeling you feel when you feel you?ôre going to feel the feeling you?ôve never felt before.,,,,,,,,,,,,,,,,,,,
Lovely lemon liniment.,,,,,,,,,,,,,,,,,,,
Love's a feeling you feel when you feel you're going to feel the feeling you've never felt before.,,,,,,,,,,,,,,,,,,,
loyal royal lawyer,,,,,,,,,,,,,,,,,,,
Lucid Lou slued loose the sluice that slew the slough.,,,,,,,,,,,,,,,,,,,
Luke Luck likes lakes. Luke's duck likes lakes. Luke Luck licks lakes. Luck's duck licks lakes. Duck takes licks in lakes Luke Luck likes. Luke Luck takes licks in lakes duck likes.,,,,,,,,,,,,,,,,,,,
Luke?ôs duck likes lakes. Luke Luck licks lakes. Luke?ôs duck licks lakes. Duck takes licks in lakes Luke Luck likes. Luke Luck takes licks in lakes duck likes.,,,,,,,,,,,,,,,,,,,
Luther?ôs sleuthing?ôs useless truth.,,,,,,,,,,,,,,,,,,,
M. R. Ducks M.R. not Ducks O. S. M. R. L. I'll B. M. R. Ducks!,,,,,,,,,,,,,,,,,,,
Mallory's hourly salary.,,,,,,,,,,,,,,,,,,,
Many an anemone sees an enemy anemone.,,,,,,,,,,,,,,,,,,,
Mares eat oats and does eat oats, and little lambs eat ivy. A Kid will eat ivy too, wouldn't ewe?,,,,,,,,,,,,,,,,,
Mares eat oats and does eat oats, but little lambs eat ivy.,,,,,,,,,,,,,,,,,,
Mares eat oats and does eat oats, and little lambs eat ivy. A Kid will eat ivy too, wouldn?ôt you?,,,,,,,,,,,,,,,,,
Mary Mac?ôs mother?ôs making Mary Mac marry me.,,,,,,,,,,,,,,,,,,,
Mary Mac's mother's making Mary Mac marry me. My mother's making me marry Mary Mac. Will I always be so Merry when Mary's taking care of me? Will I always be so merry when I marry Mary Mac?,,,,,,,,,,,,,,,,,,,
Meet Sir Cecil Thistlethwaite, the celebrated theological statistician.,,,,,,,,,,,,,,,,,,
Meter maid Mary married manly Matthew Marcus Mayo, a moody male mailman moving mostly metered mail.,,,,,,,,,,,,,,,,,,
Midget minute, midget minute, midget minute, ...,,,,,,,,,,,,,,,,
Miss Smith lisps as she talks and lists as she walks.,,,,,,,,,,,,,,,,,,,
Miss Smith?ôs fish-sauce shop seldom sells shellfish.,,,,,,,,,,,,,,,,,,,
Miss Smith's fish-sauce shop seldom sells shellfish.,,,,,,,,,,,,,,,,,,,
Mister, whither sister?ôs zither?,,,,,,,,,,,,,,,,,,
Mister Twister's tongue twisters, ...,,,,,,,,,,,,,,,,,,
Mix, Miss, Mix!,,,,,,,,,,,,,,,,,
Mixed biscuits.,,,,,,,,,,,,,,,,,,,
Mo mi mo me send me a toe, Me me mo mi get me a mole, Mo mi mo me send me a toe, Fe me mo mi get me a mole, Mister kister feet so sweet, Mister kister where will I eat !?,,,,,,,,,,,,,,
Mommy made me eat my M&Ms.,,,,,,,,,,,,,,,,,,,
Moose noshing much mush.,,,,,,,,,,,,,,,,,,,
Moses supposes his toeses are roses. But Moses supposes erroneously. For Moses, he knowses his toeses aren?ôt roses. As Moses supposes his toeses to be.,,,,,,,,,,,,,,,,,,
Moses supposes his toeses are roses. But Moses supposes erroneously. Moses, he knowses his toeses aren't roses as Moses supposes his toeses to be.,,,,,,,,,,,,,,,,,,
Mr Knott and Mr Watt on the Phone. Hello? Who's calling? Watt. What's your name? Watt's my name. Yes, what is your name? My name is John Watt. John what? Yes. I'll call on you this afternoon. All right, are you Jones? No, I'm Knott. Will you tell me your name, then? Will Knott. Why not? My name is Knott. Not what? Not Watt, Knott. What?,,,,,,,,,,,,,,
Mr. See owned a saw and Mr Soar owned a seesaw. Now See's saw sawed Soar's seesaw before Soar saw See.,,,,,,,,,,,,,,,,,,,
Mr. See owned a saw. And Mr. Soar owned a seesaw. Now See?ôs saw sawed Soar?ôs seesaw Before Soar saw See, Which made Soar sore. Had Soar seen See?ôs saw Before See sawed Soar?ôs seesaw, See?ôs saw would not have sawed Soar?ôs seesaw. So See?ôs saw sawed Soar?ôs seesaw. But it was sad to see Soar so sore Just because See?ôs saw sawed Soar?ôs seesaw!,,,,,,,,,,,,,,,,,
Mr. Tongue Twister tried to train his tongue to twist and turn, and twit an twat," to learn the letter ""T"".",,,,,,,,,,,,,,,,,
Mr. Tongue Twister tried to train his tongue to twist and turn, and twit an twat, to learn the letter ?ú‚ÄùT?ù‚Ä?,,,,,,,,,,,,,,,,,
Mrs Hunt had a country cut front in the front of her country cut pettycoat.,,,,,,,,,,,,,,,,,,,
Mrs Puggy Wuggy has a square cut punt. Not a punt cut square, Just a square cut punt. It's round in the stern and blunt in the front. Mrs Puggy Wuggy has a square cut punt.,,,,,,,,,,,,,,,,,,
Much mashed mushrooms.,,,,,,,,,,,,,,,,,,,
Mud bug, mud bug, mud bug, ...,,,,,,,,,,,,,,,,
Mumbling, bumbling. Bumbling, mumbling.,,,,,,,,,,,,,,,,,
Mummies make money.,,,,,,,,,,,,,,,,,,,
My back black brake blocks are broken.,,,,,,,,,,,,,,,,,,,
My dame hath a lame tame crane, My dame hath a crane that is lame.,,,,,,,,,,,,,,,,,,
My Friend Gladys Oh, the sadness of her sadness when she's sad. Oh, the gladness of her gladness when she's glad. But the sadness of her sadness, and the gladness of her gladness, Are nothing like her madness when she's mad!,,,,,,,,,,,,,,,
My mommy makes me muffins on Mondays.,,,,,,,,,,,,,,,,,,,
My mother?ôs making me marry Mary Mac. Will I always be so Merry when Mary?ôs taking care of me? Will I always be so merry when I marry Mary Mac?,,,,,,,,,,,,,,,,,,,
Nat the bat swat at Matt the gnat.,,,,,,,,,,,,,,,,,,,
National Sheepshire Sheep Association,,,,,,,,,,,,,,,,,,,
Near an ear, a nearer ear, a nearly eerie ear.,,,,,,,,,,,,,,,,,
Ned Nott was shot and Sam Shott was not. So it is better to be Shott than Nott. Some say Nott was not shot. But Shott says he shot Nott. Either the shot Shott shot at Nott was not shot, or Nott was shot. If the shot Shott shot shot Nott, Nott was shot. But if the shot Shott shot shot Shott, then Shott was shot, not Nott. However, the shot Shott shot shot not Shott ??but Nott.,,,,,,,,,,,,,,
Never trouble about trouble until trouble troubles you!,,,,,,,,,,,,,,,,,,,
Never trust a sloppy crust, a squally gust, ships that rust, or girls with lust. But if you must, you may trust to go bust, and back to dust, which serves you just.,,,,,,,,,,,,,
Nick knits Nixon?ôs knickers.,,,,,,,,,,,,,,,,,,,
Nine nice night nurses nursing nicely.,,,,,,,,,,,,,,,,,,,
Nine nimble noblemen nibbled nuts,,,,,,,,,,,,,,,,,,,
No need to light a night-light on a light night like tonight.,,,,,,,,,,,,,,,,,,,
No nose knows like a gnome?ôs nose knows.,,,,,,,,,,,,,,,,,,,
No nose knows like a gnome's nose knows.,,,,,,,,,,,,,,,,,,,
No shipshape ships shop stocks shop-soiled shirts.,,,,,,,,,,,,,,,,,,,
Nope, an antelope can't elope with a cantelope.,,,,,,,,,,,,,,,,,,
Normal word order or inverted word order?,,,,,,,,,,,,,,,,,,,
Norse myths.,,,,,,,,,,,,,,,,,,,
Not a knick knack knitlock knockneed knickerbocker sock with a mock-shot blob-mottled trick-ticker top clock. Not a supersheet seersucker rucksack sock, not a spot-speckled frog-freckled cheap sheik's sock off a hodge-podge moss-blotched scotch-botched block. ,,,,,,,,,,,,,,,,,,
Nothing is worth thousands of deaths.,,,,,,,,,,,,,,,,,,,
Nothing slipshod drip drop flip flop or glip glop tip me to a tip top grip top sock.,,,,,,,,,,,,,,,,,,,
Now the trees are all groaning in growling, rough gales that with thuds and hoarse roaring roll raging around! Such leaf-rousing, branch-ruining, ripping, raw wails, such a terrible, thrashing and tree-wrecking sound!,,,,,,,,,,,,,
Now they're fishing the fissure for Fisher.,,,,,,,,,,,,,,,,,,,
Octopus ocular optics and A cat snaps a rat?ôs paxwax.,,,,,,,,,,,,,,,,,,,
Octopus ocular optics.and A cat snaps a rat's paxwax.,,,,,,,,,,,,,,,,,,,
Of all the felt I ever felt, I never felt a piece of felt Which felt as fine as that felt felt, When first I felt that felt hat?ôs felt.,,,,,,,,,,,,,,,,,
Of all the felt I ever felt I never felt felt that felt like that felt felt.,,,,,,,,,,,,,,,,,,,
Oh, the sadness of her sadness when she?ôs sad. Oh, the gladness of her gladness when she?ôs glad. But the sadness of her sadness, and the gladness of her gladness, Are nothing like her madness when she?ôs mad!,,,,,,,,,,,,,,,
Old lady Hunt had a cuzzy Funt not a cuzzy Funt but a Hunt Funt cuzzy.,,,,,,,,,,,,,,,,,,,
Old Mr. Hunt had a cuddy punt Not a cuddy punt but a hunt punt cuddy.,,,,,,,,,,,,,,,,,,,
Old oily Ollie oils old oily autos.,,,,,,,,,,,,,,,,,,,
On a lazy laser raiser lies a laser ray eraser.,,,,,,,,,,,,,,,,,,,
On mules we find two legs behind and two we find before.,,,,,,,,,,,,,,,,,,,
On mules we find two legs behind and two we find before. We stand behind before we find what those behind be for.,,,,,,,,,,,,,,,,,,,
On two thousand acres, too tangled for tilling, Where thousands of thorn trees grew thrifty and thrilling, Theophilus Twistle, less thrifty than some, Thrust three thousand thistles through the thick of his thumb!,,,,,,,,,,,,,,
Once upon a barren moor There dwelt a bear, also a boar, The bear could not bear the boar, The bear thought the boar was a bore. At last the bear could bear no more That boar that bored him on the moor. And so one morn he bored the boar- That boar will bore no more!,,,,,,,,,,,,,,,,
One black beetle bled only black blood, the other black beetle bled blue.,,,,,,,,,,,,,,,,,,
One Double Dozen Double Damask Dinner Napkins,,,,,,,,,,,,,,,,,,,
One smart fellow, he felt smart. Two smart fellows, they felt smart. Three smart fellows, they felt smart. Four smart fellows, they felt smart. Five smart fellows, they felt smart. Six smart fellows, they felt smart.,,,,,,,,,,,,,
One smart fellow, he felt smart Two smart fellows, they felt smart Three smart fellows, they all felt smart,,,,,,,,,,,,,,,,
One was a racehorse, Two was one too. One won a race, Two won one too.,,,,,,,,,,,,,,,,,
One-one was a race horse. Two-two was one too. One-one won one race. Two-two won one too.,,,,,,,,,,,,,,,,,,,
Our Joe wants to know if your Joe will lend our Joe you Joe?ôs banjo. If your Joe won?ôt lend our Joe your Joe?ôs banjo our Joe won?ôt lend your Joe our Joe?ôs banjo when our Joe has a banjo!,,,,,,,,,,,,,,,,,,,
Out in the pasture the nature watcher watches the catcher. While the catcher watches the pitcher who pitches the balls. Whether the temperature?ôs up or whether the temperature?ôs down, the nature watcher, the catcher and the pitcher are always around. The pitcher pitches, the catcher catches and the watcher watches. So whether the temperature?ôs rises or whether the temperature falls the nature watcher just watches the catcher who?ôs watching the pitcher who?ôs watching the balls.,,,,,,,,,,,,,,,,
Out in the pasture the nature watcher watches the catcher. While the catcher watches the pitcher who pitches the balls. Whether the temperature's up or whether the temperature's down, the nature watcher, the catcher and the pitcher are always around. The pitcher pitches, the catcher catches and the watcher watches. So whether the temperature's rises or whether the temperature falls the nature watcher just watches the catcher who's watching the pitcher who's watching the balls.,,,,,,,,,,,,,,,,
Pacific Lithograph.,,,,,,,,,,,,,,,,,,,
Pail of ale aiding ailing Al?ôs travails.,,,,,,,,,,,,,,,,,,,
Pail of ale aiding ailing Al's travails.,,,,,,,,,,,,,,,,,,,
Paul, please pause for proper applause.,,,,,,,,,,,,,,,,,,
Peggy Babcock, Peggy Babcock, Peggy Babcock, ...,,,,,,,,,,,,,,,,
Peggy Babcock.,,,,,,,,,,,,,,,,,,,
People pledging plenty of pennies.,,,,,,,,,,,,,,,,,,,
Pete?ôs pa pete poked to the pea patch to pick a peck of peas for the poor pink pig in the pine hole pig-pen.,,,,,,,,,,,,,,,,,,,
Peter Piper picked a peck of pickled peppers. A peck of pickled peppers Peter Piper picked. If Peter Piper picked a peck of pickled peppers, Where's the peck of pickled peppers Peter Piper picked?,,,,,,,,,,,,,,,,,,
Peter Piper picked a peck of pickled peppers. Did Peter Piper pick a peck of pickled peppers? If Peter Piper Picked a peck of pickled peppers, Where?ôs the peck of pickled peppers Peter Piper picked?,,,,,,,,,,,,,,,,,,
Peter poked a poker at the piper, so the piper poked pepper at Peter.,,,,,,,,,,,,,,,,,,
Peter Rabbit raddish robber,,,,,,,,,,,,,,,,,,,
Pete's pa pete poked to the pea patch to pick a peck of peas for the poor pink pig in the pine hole pig-pen.,,,,,,,,,,,,,,,,,,,
Pick a partner and practice passing, for if you pass proficiently, perhaps you?ôll play professionally.,,,,,,,,,,,,,,,,,
Picky people pick Peter Pan Peanut Butter. Peter Pan Peanut is the peanut picky people pick.,,,,,,,,,,,,,,,,,,,
Picky people pick Peter Pan Peanut-Butter, 'tis the peanut-butter picky people pick.,,,,,,,,,,,,,,,,,,
Pirates Private Property,,,,,,,,,,,,,,,,,,,
Plague-bearing prairie dogs.,,,,,,,,,,,,,,,,,,,
Plaid pleated pants, Plaid pleated pants, Plaid pleated pants, ...,,,,,,,,,,,,,,,,
Plain bun, plum bun, bun without plum.,,,,,,,,,,,,,,,,,
Please pay promptly.,,,,,,,,,,,,,,,,,,,
Plymouth sleuths thwart Luther?ôs slithering.,,,,,,,,,,,,,,,,,,,
Plymouth sleuths thwart Luther's slithering.,,,,,,,,,,,,,,,,,,,
Polish it in the corner. Polish it in the corner. Polish it in the corner. ...,,,,,,,,,,,,,,,,,,,
Pooped purple pelicans.,,,,,,,,,,,,,,,,,,,
Pope Sixtus VI?ôs six texts.,,,,,,,,,,,,,,,,,,,
Preshrunk silk shirts.,,,,,,,,,,,,,,,,,,,
Pretty Kitty Creighton had a cotton batten cat. The cotton batten cat was bitten by a rat. The kitten that was bitten had a button for an eye, And biting off the button made the cotton batten fly.,,,,,,,,,,,,,,,,,,
Pro bono boa prose,,,,,,,,,,,,,,,,,,,
Purple paper people, purple paper people, purple paper people, ...,,,,,,,,,,,,,,,,
Quick kiss. Quicker kiss. Quickest kiss.,,,,,,,,,,,,,,,,,,,
Quick queens quack quick quacks quicker than quacking quails.,,,,,,,,,,,,,,,,,,,
Raise Ruth?ôs red roof.,,,,,,,,,,,,,,,,,,,
Ralph rakes leaves really, really lousily.,,,,,,,,,,,,,,,,,,
Rather Ruth's writhings than Roth's wrath.,,,,,,,,,,,,,,,,,,,
Rattle your bottles in Rollocks' van.,,,,,,,,,,,,,,,,,,,
Rattle your bottles in Rollocks??van.,,,,,,,,,,,,,,,,,,,
Ray Rag ran across a rough road. Across a rough road Ray Rag ran. Where is the rough road Ray Rag ran across?,,,,,,,,,,,,,,,,,,,
real rear wheel,,,,,,,,,,,,,,,,,,,
Real rock wall, real rock wall, real rock wall,,,,,,,,,,,,,,,,,
Real weird rear wheels,,,,,,,,,,,,,,,,,,,
Really leery, rarely Larry.,,,,,,,,,,,,,,,,,,
Really very weary, really very weary, really very weary, ...,,,,,,,,,,,,,,,,
Red blood, green blood.,,,,,,,,,,,,,,,,,,
Red Buick, blue Buick,,,,,,,,,,,,,,,,,,
Red leather, yellow leather, ...,,,,,,,,,,,,,,,,,
Red lolly, yellow lolly.,,,,,,,,,,,,,,,,,,
Red lorry, yellow lorry.,,,,,,,,,,,,,,,,,,
Reed Wade Road,,,,,,,,,,,,,,,,,,,
Rhys watched Ross switch his Irish wristwatch for a Swiss wristwatch.,,,,,,,,,,,,,,,,,,,
Richard?ôs wretched ratchet wrench.,,,,,,,,,,,,,,,,,,,
Richard's wretched ratchet wrench.,,,,,,,,,,,,,,,,,,,
Ripe white wheat reapers reap ripe white wheat right.,,,,,,,,,,,,,,,,,,,
Road-roller,,,,,,,,,,,,,,,,,,,
Robert Wayne Rutter,,,,,,,,,,,,,,,,,,,
Roberta ran rings around the Roman ruins.,,,,,,,,,,,,,,,,,,,
Robin Redbreast?ôs bad breath,,,,,,,,,,,,,,,,,,,
Roland road in a Rolls Royce.,,,,,,,,,,,,,,,,,,,
Rolling red wagons,,,,,,,,,,,,,,,,,,,
Roofs of mushrooms rarely mush too much.,,,,,,,,,,,,,,,,,,,
Rory the warrior and Roger the worrier were reared wrongly in a rural brewery.,,,,,,,,,,,,,,,,,,,
Round and round the rugged rocks the ragged rascal ran.,,,,,,,,,,,,,,,,,,,
Round brown bread,,,,,,,,,,,,,,,,,,,
Roy Rash, Roy Rogers, Roy Wayne.,,,,,,,,,,,,,,,,,
Roy Wayne Roy Rogers Roy Rash,,,,,,,,,,,,,,,,,,,
Rubber baby-buggy bumpers.,,,,,,,,,,,,,,,,,,,
Rubber Berber Gerber's Burger,,,,,,,,,,,,,,,,,,,
Ruby Rugby?ôs brother bought and brought her back some rubber baby-buggy bumpers.,,,,,,,,,,,,,,,,,,,
rudder valve reversals,,,,,,,,,,,,,,,,,,,
Rudder valve reversals,,,,,,,,,,,,,,,,,,,
Rugged rubber baby buggy bumpers.,,,,,,,,,,,,,,,,,,,
Rural ruler,,,,,,,,,,,,,,,,,,,
Rush the washing, Russel!,,,,,,,,,,,,,,,,,,
Ruth?ôs red roof.,,,,,,,,,,,,,,,,,,,
Sally is a sheet slitter, she slits sheets.,,,,,,,,,,,,,,,,,,
Sally sells sea shells by the sea shore. But if Sally sells sea shells by the sea shore then where are the sea shells Sally sells?,,,,,,,,,,,,,,,,,,,
Salty broccoli, salty broccoli, salty broccoli,,,,,,,,,,,,,,,,,
Sam?ôs shop stocks short spotted socks.,,,,,,,,,,,,,,,,,,,
Santa's Short Suit Shrunk,,,,,,,,,,,,,,,,,,,
Sarah, Sarah, sits in her Chevrolet. When she shifts she sips her Schlitz, and when she sips her Schlitz she shifts.,,,,,,,,,,,,,,,,
Sarah saw a shot-silk sash shop full of shot-silk sashes as the sunshine shone on the side of the shot-silk sash shop.,,,,,,,,,,,,,,,,,,,
Sarah sitting in her Chevrolet, All she does is sits and shifts, All she does is sits and shifts.,,,,,,,,,,,,,,,,,
Say this sharply, say this sweetly; Say this shortly, say this softly; Say this sixteen times in succession.,,,,,,,,,,,,,,,,,
Scissors or soothers, scissors or soothers, scissors or soothers, ...,,,,,,,,,,,,,,,,
Scissors sizzle, thistles sizzle.,,,,,,,,,,,,,,,,,,
Selfish sharks sell shut shellfish.,,,,,,,,,,,,,,,,,,,
Send toast to ten tense stout saints' ten tall tents.,,,,,,,,,,,,,,,,,,,
Send toast to ten tense stout saints??ten tall tents.,,,,,,,,,,,,,,,,,,,
Seth at Sainsbury?ôs sells thick socks.,,,,,,,,,,,,,,,,,,,
Seth at Sainsbury's sells thick socks.,,,,,,,,,,,,,,,,,,,
Seth?ôs sharp spacesuit shrank.,,,,,,,,,,,,,,,,,,,
Seven sleazy shysters in sharkskin suits sold sheared sealskins to seasick sailors.,,,,,,,,,,,,,,,,,,,
Seven slick and sexy sealskin ski suits slid slowly down the slope.,,,,,,,,,,,,,,,,,,,
Seven slick slimey snakes slowly sliding southward.,,,,,,,,,,,,,,,,,,,
Seventy seven benevolent elephants,,,,,,,,,,,,,,,,,,,
Sexist sixties.,,,,,,,,,,,,,,,,,,,
Shannon shant ship ships through Shilshole.,,,,,,,,,,,,,,,,,,,
She had shoulder surgery.,,,,,,,,,,,,,,,,,,,
She is a thistle-sifter. She has a sieve of unsifted thistles and a sieve of sifted thistles and the sieve of unsifted thistles she sifts into the sieve of sifted thistles because she is a thistle-sifter.,,,,,,,,,,,,,,,,,,,
She said she should sit.,,,,,,,,,,,,,,,,,,,
She said she should sit. Mo mi mo me send me a toe, Me me mo mi get me a mole, Mo mi mo me send me a toe, Fe me mo mi get me a mole, Mister kister feet so sweet, Mister kister where will I eat!?,,,,,,,,,,,,,,
She sat upon a balcony, inimicably mimicking him hiccuping and amicably welcoming him in.,,,,,,,,,,,,,,,,,,
She saw Sherif?ôs shoes on the sofa. But was she so sure she saw Sherif?ôs shoes on the sofa?,,,,,,,,,,,,,,,,,,,
She saw Sherif's shoes on the sofa. But was she so sure she saw Sherif's shoes on the sofa?,,,,,,,,,,,,,,,,,,,
She sees cheese.,,,,,,,,,,,,,,,,,,,
She sees seas slapping shores.,,,,,,,,,,,,,,,,,,,
She sees seashells by the seashore.,,,,,,,,,,,,,,,,,,,
She sells sea shells on the sea shore; The shells that she sells are sea shells I'm sure. So if she sells sea shells on the sea shore, I'm sure that the shells are sea shore shells.,,,,,,,,,,,,,,,,,,
She sells sea shells on the seashore. The seashells she sells are seashells she is sure.,,,,,,,,,,,,,,,,,,,
She sells seashells by the seashore. The shells she sells are surely seashells. So if she sells shells on the seashore, I?ôm sure she sells seashore shells.,,,,,,,,,,,,,,,,,,
She sells seashells on the seashore. The seashells she sells are seashore seashells.,,,,,,,,,,,,,,,,,,,
She sifted thistles through her thistle-sifter.,,,,,,,,,,,,,,,,,,,
She sits in her slip and sips Schlitz.,,,,,,,,,,,,,,,,,,,
She slits the sheet she sits on.,,,,,,,,,,,,,,,,,,,
She snapped a selfie with Sophie's silver cell phone.,,,,,,,,,,,,,,,,,,,
She stood by Burgess?ôs fish sauce shop welcoming him in.,,,,,,,,,,,,,,,,,,,
She stood on the balcony, inexplicably mimicking him hiccuping, and amicably welcoming him in.,,,,,,,,,,,,,,,,,
She stood on the steps of Burgess's Fish Sauce Shop, mimicking him hiccuping and amicably welcoming him in.,,,,,,,,,,,,,,,,,,
She surely suits shiny sleek short skirts.,,,,,,,,,,,,,,,,,,,
She thrust three thousand thistles through the thick of her thumb.,,,,,,,,,,,,,,,,,,,
Sheena leads, Sheila needs.,,,,,,,,,,,,,,,,,,
Sheep shouldn?ôt sleep in a shack. Sheep should sleep in a shed.,,,,,,,,,,,,,,,,,,,
Sheila is selling her shop at the seashore for shops at the seashore are so sure to lose. And she's not so sure of what she should be selling. Should Sheila sell seashells or should she sell shoes?,,,,,,,,,,,,,,,,,,,
Shelter for six sick scenic sightseers.,,,,,,,,,,,,,,,,,,,
Sherman shops at cheap chop suey shops.,,,,,,,,,,,,,,,,,,,
Sherry hates hairy states.,,,,,,,,,,,,,,,,,,,
Shine my city shoes!,,,,,,,,,,,,,,,,,,,
Shoe section, shoe section, shoe section, ...,,,,,,,,,,,,,,,,
Shoe section, shoe section, shoe section,,,,,,,,,,,,,,,,,
Short folder.,,,,,,,,,,,,,,,,,,,
Shredded Swiss chesse.,,,,,,,,,,,,,,,,,,,
Shriek, screak, squawk, and squeak.,,,,,,,,,,,,,,,,
Shut up the shutters and sit in the shop.,,,,,,,,,,,,,,,,,,,
Shy Shelly says she shall sew sheets.,,,,,,,,,,,,,,,,,,,
Silly Sally Shouldnort shaved sheep she should show soon so selling sheep shaved showed she shouldn't show shaved sheep so soon.,,,,,,,,,,,,,,,,,,,
Silly Sally swiftly shooed seven silly sheep. The seven silly sheep Silly Sally shooed Shilly-shallied south. These sheep shouldn?ôt sleep in a shack; Sheep should sleep in a shed.,,,,,,,,,,,,,,,,,,,
Silly sheep still asleep.,,,,,,,,,,,,,,,,,,,
Silly sheep weep and sleep.,,,,,,,,,,,,,,,,,,,
Silly shoe-fly pie fans sell chilly shoe-fly pie pans.,,,,,,,,,,,,,,,,,,,
Sinful Caesar sipped his snifter, seized his knees and sneezed.,,,,,,,,,,,,,,,,,,
Sinful Caesar sipped his snifter, seized his knees, and sneezed.,,,,,,,,,,,,,,,,,
Singing Sammy sung songs on sinking sand.,,,,,,,,,,,,,,,,,,,
Sister Susie's sewing shirts for soldiers, such saucy soft short shirts for soldiers sister Susie sews, some soldiers send epistles say they'd sooner sleep on thistles, than those saucy soft short shirts for soldiers, Sister Susie sews.,,,,,,,,,,,,,,,
Sister Suzie sewing shirts for soldiers Such skill as sewing shirts Our shy young sister Suzie shows Some soldiers send epistles Say they'd rather sleep in thistles Than the saucy, soft short shirts for soldiers Sister Suzie sews.,,,,,,,,,,,,,,,,,,
Six crisp snacks.,,,,,,,,,,,,,,,,,,,
Six Czech cricket critics,,,,,,,,,,,,,,,,,,,
Six sharp smart sharks.,,,,,,,,,,,,,,,,,,,
Six shimmering sharks sharply striking shins.,,,,,,,,,,,,,,,,,,,
Six shining cities, six shining cities, six shining cities.,,,,,,,,,,,,,,,,,
Six short slow shepherds.,,,,,,,,,,,,,,,,,,,
Six shy shavers sheared six shy sheep.,,,,,,,,,,,,,,,,,,,
Six sick hicks nick six slick bricks with picks and sticks.,,,,,,,,,,,,,,,,,,,
Six sick sea-serpents swam the seven seas.,,,,,,,,,,,,,,,,,,,
Six sick sheep.,,,,,,,,,,,,,,,,,,,
Six sick slick slim sycamore saplings.,,,,,,,,,,,,,,,,,,,
Six sleek swans swam swiftly southwards.,,,,,,,,,,,,,,,,,,,
Six slick, slim, slender saplings.,,,,,,,,,,,,,,,,,
Six slimy snails sailed silently.,,,,,,,,,,,,,,,,,,,
Six slippery snails slid slowly seaward.,,,,,,,,,,,,,,,,,,,
Six sticky skeletons, six sticky skeletons, six sticky skeletons, ...,,,,,,,,,,,,,,,,
Six sticky sucker sticks.,,,,,,,,,,,,,,,,,,,
Six thick thistle sticks,,,,,,,,,,,,,,,,,,,
Six thick thistle sticks. Six thick thistles stick.,,,,,,,,,,,,,,,,,,,
Six twin-screwed steel steam cruisers.,,,,,,,,,,,,,,,,,,,
Sixish.,,,,,,,,,,,,,,,,,,,
Sixty silly sisters simply singing.,,,,,,,,,,,,,,,,,,,
Sleep sweetly! Sleep sweetly! Sleep sweetly!,,,,,,,,,,,,,,,,,,,
Slick slim slippers sliding south.,,,,,,,,,,,,,,,,,,,
Slinking, sliding, slithering slyly, swiftly slipping through the grasses shyly, silent but for swish and hiss is the sinuous snake's leglessness.,,,,,,,,,,,,,,,
Snap Crackel pop, Snap Crackel pop, Snap Crackel pop.,,,,,,,,,,,,,,,,,
Sniff Sesh! Sniff Sesh! Sniff Sesh!,,,,,,,,,,,,,,,,,,,
So, this is the sushi chef?,,,,,,,,,,,,,,,,,,
