11 was a racehorse, 22 was 12, 1111 race,22112,,,,,,,,,,,,,,,,
2 Y's U R. 2 Y's U B. I C U R. 2 Y's 4 me!,,,,,,,,,,,,,,,,,,,
A big black bear sat on a big black bug.,,,,,,,,,,,,,,,,,,,
A big black bug bit a big black bear and made the big black bear bleed blood.,,,,,,,,,,,,,,,,,,,
A big black bug bit a big black dog on his big black nose!,,,,,,,,,,,,,,,,,,,
A big bug bit a bold bald bear and the bold bald bear bled blood badly.,,,,,,,,,,,,,,,,,,,
A bitter biting bittern bit a better biting bittern and the better biting bittern bit the bitter biting bittern back. Said the bitter biting bittern to the better biting bittern a bitter biting bittern bitten back.,,,,,,,,,,,,,,,,,,,
A bitter biting bittern Bit a better brother bittern, And the bitter better bittern Bit the bitter biter back. And the bitter bittern, bitten, By the better bitten bittern, Said: ?úI?ôm a bitter biter bit, alack!??,,,,,,,,,,,,,,
A black bloke's back brake-block broke.,,,,,,,,,,,,,,,,,,,
A black bug?ôs blood Irish wristwatch Legend tripping Liril,,,,,,,,,,,,,,,,,,,
A bloke?ôs bike back brake block broke.,,,,,,,,,,,,,,,,,,,
A bloke's bike back brake block broke.,,,,,,,,,,,,,,,,,,,
A box of biscuits, a box of mixed biscuits, and a biscuit mixer.,,,,,,,,,,,,,,,,,
A box of biscuits, a batch of mixed biscuits,,,,,,,,,,,,,,,,,,
A canner can can anything that he can, But a canner can?ôt can a can, can he?,,,,,,,,,,,,,,,,,
A canner exceedingly canny, one morning remarked to his granny, a canner can can, anything that he can, but a canner can't can a can; can he?,,,,,,,,,,,,,,,
A certain young fellow named Beebee Wished to marry a lady named Phoebe ?úBut,??he said. ?úI must see What the minister?ôs fee be Before Phoebe be Phoebe Beebee??,,,,,,,,,,,,,,,,,,
A cheap ship trip.,,,,,,,,,,,,,,,,,,,
A cricket critic,,,,,,,,,,,,,,,,,,,
A cunning young canner from Canning once observed to his granny," ""A canner can can a lot of things gran", but a canner can't can a can," can he?"" How many ducks could a duck duct-tape", if a duck could duct-tape ducks?,,,,,,,,,,,,,,,
A cup of proper coffee in a copper coffee cup.,,,,,,,,,,,,,,,,,,,
A cupcake cook in a cupcake cook?ôs cap cooks cupcakes.,,,,,,,,,,,,,,,,,,,
A dozen double damask dinner napkins.,,,,,,,,,,,,,,,,,,,
A dull, dark dock, a life-long lock. A short, sharp shock, a big black block!,,,,,,,,,,,,,,,
A fat thrush flies through thick fog.,,,,,,,,,,,,,,,,,,,
A flea and a fly flew up in a flue. Said the flea, ?úLet us fly!??Said the fly, ?úLet us flee!??So they flew through a flaw in the flue.,,,,,,,,,,,,,,,,,
A flea and a fly in a flue, were imprisoned. So what could they do? Said the fly," ""Let us flee"". Said the flea"," ""Let us fly"". So they flew through a flaw in the flue.",,,,,,,,,,,,,,,,
A fly and flea flew into a flue, said the fly to the flea 'what shall we do?' 'let us fly' said the flea said the fly 'shall we flee' so they flew through a flaw in the flue.,,,,,,,,,,,,,,,,,,
A fly and flea flew into a flue, said the fly to the flea ?òwhat shall we do????òlet us fly??said the flea said the fly ?òshall we flee??so they flew through a flaw in the flue.,,,,,,,,,,,,,,,,,,
A gazillion gigantic grapes gushed gradually giving gophers gooey guts.,,,,,,,,,,,,,,,,,,,
A gazillion gigantic grapes gushed gradually giving gophers gooey guts.,,,,,,,,,,,,,,,,,,,
A gentle judge judges justly.,,,,,,,,,,,,,,,,,,,
A haddock! A haddock! A black-spotted haddock! A black spot On the black back Of a black-spotted haddock!,,,,,,,,,,,,,,,,,,,
A happy hippo hopped and hiccupped.,,,,,,,,,,,,,,,,,,,
A knapsack strap.,,,,,,,,,,,,,,,,,,,
"A lady sees a pot-mender at work at his barrow in the street. ""Are you copper-bottoming 'em"," man?"" ""No", I'm aluminiuming 'em," Mam.""",,,,,,,,,,,,,,,,
A lady sees a pot-mender at work at his barrow in the street. ?úAre you copper-bottoming them, my man????úNo, I?ôm aluminiuming ?ôem, Mum??,,,,,,,,,,,,,,,,
A laurel-crowned clown.,,,,,,,,,,,,,,,,,,,
A loyal warrior will rarely worry why we rule.,,,,,,,,,,,,,,,,,,,
A lump of red leather, a red leather lump,,,,,,,,,,,,,,,,,,
A lump of red leather, a red leather lump,,,,,,,,,,,,,,,,,,
A lusty lady loved a lawyer and longed to lure him from his laboratory.,,,,,,,,,,,,,,,,,,,
A maid named Lady Marmalade made mainly lard and lemonade. M'lady lamely never made a well-named, labelled marmalade.,,,,,,,,,,,,,,,,,,
A missing mixture measure.,,,,,,,,,,,,,,,,,,,
A mother to her son did utter ?úGo, my son, and shut the shutter???úThe shutter?ôs shut??the son did utter ?úI cannot shut it any shutter!??,,,,,,,,,,,,,,,,,
A noise annoys an oyster, but a noisy noise annoys an oyster more!,,,,,,,,,,,,,,,,,,
A nurse anesthetist unearthed a nest.,,,,,,,,,,,,,,,,,,,
A pack of pesky pixies.,,,,,,,,,,,,,,,,,,,
A pessimistic pest exists amidst us.,,,,,,,,,,,,,,,,,,,
A pessimistic pest exists amidst us. Knife and a fork bottle and a cork that is the way you spell New York. Chicken in the car and the car can go, that is the way you spell Chicago.,,,,,,,,,,,,,,,,,,
A pleasant place to place a plaice is a place where a plaice is pleased to be placed.,,,,,,,,,,,,,,,,,,,
A proper cup of coffee from a proper copper coffee pot.,,,,,,,,,,,,,,,,,,,
A purely rural duel truly plural is better than a purely plural duel truly rural.,,,,,,,,,,,,,,,,,,,
A quick witted cricket critic.,,,,,,,,,,,,,,,,,,,
A real rare whale.,,,,,,,,,,,,,,,,,,,
A rough-coated, dough-faced, thoughtful ploughman strode through the streets of Scarborough; after falling into a slough, he coughed and hiccoughed.,,,,,,,,,,,,,,,,
A sad story about Nobody: This is a story about four people named Everybody, Somebody, Anybody and Nobody. There was an important job to be done and Everybody was sure that Somebody would do it. Anybody could have done it, but Nobody did it. Somebody got angry about that, because it was Everybody's job. Everybody thought Anybody could do it, but Nobody realised that Everybody wouldn't do it. It ended up that Everybody blamed Somebody, when Nobody did, what Anybody could have done.,,,,,,,,,,,,
A singly circularly linked list.,,,,,,,,,,,,,,,,,,,
A skunk sat on a stump and thunk the stump stunk, but the stump thunk the skunk stunk.,,,,,,,,,,,,,,,,,,
A slimey snake slithered down the sandy sahara.,,,,,,,,,,,,,,,,,,,
A smart fella, a fella smart. It takes a smart fella to say a fella smart.,,,,,,,,,,,,,,,,,,
A snake sneaks to seek a snack.,,,,,,,,,,,,,,,,,,,
A synonym for cinnamon is a cinnamon synonym.,,,,,,,,,,,,,,,,,,,
A tidy tiger tied a tie tighter to tidy her tiny tail,,,,,,,,,,,,,,,,,,,
A tree toad loved a she-toad, who lived up in a tree. He was a three-toed tree toad, But a two-toed toad was she. The three-toed tree toad tried to win the two-toed she-toad's heart, for the three-toed tree toad loved the ground, that the two-toed tree toad trod. But the three-toed tree toad tried in vain. He couldn't please her whim. From her tree toad bower with her two-toed power, the she-toad vetoed him.,,,,,,,,,,,,,,
A tree toad loved a she-toad Who lived up in a tree. He was a two-toed tree toad But a three-toed toad was she. The two-toed tree toad tried to win The three-toed she-toad?ôs heart, For the two-toed tree toad loved the ground That the three-toed tree toad trod. But the two-toed tree toad tried in vain. He couldn?ôt please her whim. From her tree toad bower With her three-toed power The she-toad vetoed him.,,,,,,,,,,,,,,,,,,
A truly rural frugal ruler?ôs mural.,,,,,,,,,,,,,,,,,,,
A turbot?ôs not a burbot, for a turbot?ôs a butt, but a burbot?ôs not.,,,,,,,,,,,,,,,,,
A turbot's not a burbot, for a turbot's a butt, but a burbot's not.,,,,,,,,,,,,,,,,,
A tutor who tooted the flute Tried to tutor two tooters to toot Said the two to the tutor ?úIs it tougher to toot Or to tutor two tooters to toot???,,,,,,,,,,,,,,,,,,,
A twister of twists once twisted a twist, and the twist that he twisted was a three-twisted twist. Now in twisting this twist, if a twist should untwist, would the twist that untwisted untwist the twists?,,,,,,,,,,,,,,,,
A twister of twists once twisted a twist. and the twist that he twisted was a three twisted twist. now in twisting this twist, if a twist should untwist, would the twist that untwisted untwist the twists,,,,,,,,,,,,,,,,,
A woman to her son did utter, ?úGo my son, and shut the shutter.???úThe shutter?ôs shut,??the son did utter, ?úI cannot shut it any shutter.??,,,,,,,,,,,,,,,
A wooden worm wouldn't be worthy of worship but would he if he wondered and worried about what he would be worthy of if he wasn't wooden?,,,,,,,,,,,,,,,,,,,
Admidst the mists and coldest frosts, With stoutest wrists and loudest boasts, He thrusts his fists against the posts, And still insists he sees the ghosts.,,,,,,,,,,,,,,,,
Ah shucks, six stick shifts stuck shut!,,,,,,,,,,,,,,,,,,
Alice asks for axes.,,,,,,,,,,,,,,,,,,,
All day long he fits and tucks, all day long he tucks and fits, and fits and tucks, and tucks and fits, and fits and tucks, and tucks and fits.,,,,,,,,,,,,,,
All I want is a proper cup of coffee Made in a proper copper coffee pot. You can believe it or not, But I just want a cup of coffee In a proper coffee pot. Tin coffee pots Or iron coffee pots Are of no use to me. If I can?ôt have A proper cup of coffee In a proper copper coffee pot, I?ôll have a cup of tea!,,,,,,,,,,,,,,,,,
Aluminum, linoleum, molybdenum, aluminum, linoleum, molybdenum, aluminum, linoleum, molybdenum.,,,,,,,,,,,
Aluminum, linoleum, aluminum, linoleum, aluminum, linoleum.,,,,,,,,,,,,,,
Am I and Amy aiming anemic anemonies on my many enemies?,,,,,,,,,,,,,,,,,,,
Amidst the mists and coldest frosts, With stoutest wrists and loudest boasts, He thrusts his fists against the posts, And still insists he sees the ghosts.,,,,,,,,,,,,,,,,
Amidst the mists and coldest frosts, with stoutest wrists and loudest boasts, he thrusts his fist against the posts and still insists he sees the ghosts.,,,,,,,,,,,,,,,,,
An elephant was asphyxiated in the asphalt.,,,,,,,,,,,,,,,,,,,
An illusory vision is a visionary illusion. Is it?,,,,,,,,,,,,,,,,,,,
An inchworm inches on ivy that itches.,,,,,,,,,,,,,,,,,,,
An undertaker undertook to under take an undertaking. The undertaking that the undertaker undertook was the hardest undertaking the undertaker ever undertook to undertake.,,,,,,,,,,,,,,,,,,,
Ann and Andy?ôs anniversary is in April.,,,,,,,,,,,,,,,,,,,
Ann and Andy's anniversary is in April.,,,,,,,,,,,,,,,,,,,
Announcement at Victoria Station, London: Two to two to Tooting too!,,,,,,,,,,,,,,,,,,
Any noise annoys an oyster, but a noisy noise annoys an oyster more!,,,,,,,,,,,,,,,,,,
Ape Cakes, Grape Cakes.,,,,,,,,,,,,,,,,,,
Are our oars oak?,,,,,,,,,,,,,,,,,,,
Argyle Gargoyle,,,,,,,,,,,,,,,,,,,
Arnold Palmer, Arnold Palmer, Arnold Palmer, ...,,,,,,,,,,,,,,,,
As he gobbled the cakes on his plate, the greedy ape said as he ate, the greener green grapes are, the keener keen apes are to gobble green grape cakes, they're great!,,,,,,,,,,,,,,,
As I was in Arkansas I saw a saw that could out saw any saw I ever saw saw. If you happen to be in Arkansas and see a saw that can out saw the saw I saw saw I'd like to see the saw you saw saw.,,,,,,,,,,,,,,,,,,,
As one black bug, bled blue, black blood. The other black bug bled blue.,,,,,,,,,,,,,,,,,
Awful old Ollie oils oily autos.,,,,,,,,,,,,,,,,,,,
Bad black bran bread.,,,,,,,,,,,,,,,,,,,
Bad dead bed-bugs bleed bug blood.,,,,,,,,,,,,,,,,,,,
Bake big batches of bitter brown bread.,,,,,,,,,,,,,,,,,,,
Bake big batches of brown blueberry bread.,,,,,,,,,,,,,,,,,,,
Betty and Bob brought back blue balloons from the big bazaar.,,,,,,,,,,,,,,,,,,,
Betty beat a bit of butter to make a better batter.,,,,,,,,,,,,,,,,,,,
Betty Botter bought a bit of butter. ?úBut,??said she, ?úthis butter?ôs bitter. If I put it in my batter, It will make my batter bitter. But a bit of better butter- That would make my batter better.??So Betty Botter bought a bit of better butter (better than her bitter butter) And she put it in her bitter batter And made her bitter batter a bit better.,,,,,,,,,,,,,,,,
Betty Botter bought some butter but, said she, the butter's bitter. If I put it in my batter, it will make my batter bitter. But a bit of better butter will make my bitter batter better. So she bought some better butter, better than the bitter butter, put it in her bitter batter, made her bitter batter better. So 't was better Betty Botter bought some better butter.,,,,,,,,,,,,,
Big bad bugs bit Bitsy?ôs back.,,,,,,,,,,,,,,,,,,,
Big ben blew big blue bubbles.,,,,,,,,,,,,,,,,,,,
Big black bugs bleed blue black blood but baby black bugs bleed blue blood.,,,,,,,,,,,,,,,,,,,
Bill had a billboard, Bill also had a board bill. The billboard bored Bill so Bill sold the billboard to pay for the board bill.??,,,,,,,,,,,,,,,,,,
Bill had a billboard. Bill also had a board bill. The board bill bored Bill, So Bill sold his billboard And paid his board bill. Then the board bill No longer bored Bill, But though he had no board bill, Neither did he have his billboard! Black back bat,,,,,,,,,,,,,,,,
Birdie birdie in the sky laid a turdie in my eye. If cows could fly I'd have a cow pie in my eye.,,,,,,,,,,,,,,,,,,,
black back bat,,,,,,,,,,,,,,,,,,,
Black background, brown background.,,,,,,,,,,,,,,,,,,
Black Rock Brain Lock,,,,,,,,,,,,,,,,,,,
Blake?ôs black bike?ôs back brake bracket block broke.,,,,,,,,,,,,,,,,,,,
Blake's black bike's back brake bracket block broke.,,,,,,,,,,,,,,,,,,,
Blended baby blue bug's blood blotches.,,,,,,,,,,,,,,,,,,,
Blue glue gun, green glue gun.,,,,,,,,,,,,,,,,,,
"Bobby Bippy bought a bat. Bobby Bippy bought a ball. With his bat Bob banged the ball Banged it bump against the wall But so boldly Bobby banged it That he burst his rubber ball ""Boo!"" cried Bobby Bad luck ball Bad luck Bobby", bad luck ball Now to drown his many troubles Bobby Bippy's blowing bubbles.,,,,,,,,,,,,,,,,,,
Bobby Bippy bought a bat. Bobby Bippy bought a ball. With his bat Bob banged the ball Banged it bump against the wall But so boldly Bobby banged it That he burst his rubber ball ?ú‚ÄùBoo!?ù‚Ä?cried Bobby Bad luck ball Bad luck Bobby, bad luck ball Now to drown his many troubles Bobby Bippy?ôs blowing bubbles.,,,,,,,,,,,,,,,,,,
Bob's pop-up blocker blocks Bob's pop-ups.,,,,,,,,,,,,,,,,,,,
Brad?ôs big black bath brush broke.,,,,,,,,,,,,,,,,,,,
Brent Spence Bridge Clay Wade Bailey Bridge,,,,,,,,,,,,,,,,,,,
Bright blows the broom on the brook?ôs bare brown banks.,,,,,,,,,,,,,,,,,,,
Brisk brave brigadiers brandished broad bright blades, blunderbusses, and bludgeons ??balancing them badly.,,,,,,,,,,,,,,,,,
Broken back brake block,,,,,,,,,,,,,,,,,,,
Broken blue crayon,,,,,,,,,,,,,,,,,,,
Buckets of bug blood, buckets of bug blood, buckets of bug blood.,,,,,,,,,,,,,,,,,
Bug's black blood, Black bug's blood.,,,,,,,,,,,,,,,,,,
Burger burglar,,,,,,,,,,,,,,,,,,,
Busy buzzing bumble bees.,,,,,,,,,,,,,,,,,,,
But a harder thing still to do. What a to do to die today At a quarter or two to two. A terrible difficult thing to say But a harder thing still to do. The dragon will come at the beat of the drum With a rat-a-tat-tat a-tat-tat a-tat-to At a quarter or two to two today, At a quarter or two to two.,,,,,,,,,,,,,,,,,,
But she as far surpasse th Sycorax, As great?ôst does least.,,,,,,,,,,,,,,,,,,
But she as far surpasseth Sycorax, As great'st does least.,,,,,,,,,,,,,,,,,,
Can you can a can as a canner can can a can?,,,,,,,,,,,,,,,,,,,
Can you imagine an imaginary menagerie manager imagining managing an imaginary menagerie?,,,,,,,,,,,,,,,,,,,
Carolina Herrera resides in the rural area with her running horses.,,,,,,,,,,,,,,,,,,,
Casual clothes are provisional for leisurely trips across Asia.,,,,,,,,,,,,,,,,,,,
Caution: Wide Right Turns,,,,,,,,,,,,,,,,,,,
Cedar shingles should be shaved and saved.,,,,,,,,,,,,,,,,,,,
Celibate celebrant, celibate celebrant, celibate celebrant, ...,,,,,,,,,,,,,,,,
Celibate celebrant, celibate celebrant, celibate celebrant.,,,,,,,,,,,,,,,,,
Certified certificates from certified certificate certifiers.,,,,,,,,,,,,,,,,,,,
Cheap Sheep Sheets, Cheap Sheep Sheets, Cheap Sheep Sheets.,,,,,,,,,,,,,,,,,
Cheap sheep soup.,,,,,,,,,,,,,,,,,,,
Cheap ship trip.,,,,,,,,,,,,,,,,,,,
Cheryl?ôs chilly cheap chip shop sells Cheryl?ôs cheap chips.,,,,,,,,,,,,,,,,,,,
Chester Cheetah chews a chunk of cheep cheddar cheese.,,,,,,,,,,,,,,,,,,,
Chester chooses chestnuts, cheddar cheese with chewy chives. He chews them and he chooses them. He chooses them and he chews them. Those chestnuts, cheddar cheese and chives in cheery, charming chunks.,,,,,,,,,,,,,,,,
Chill, Shake, Serve, ...,,,,,,,,,,,,,,,,
chip shop chips,,,,,,,,,,,,,,,,,,,
Chocolate chip cookies in a copper coffee cup.,,,,,,,,,,,,,,,,,,,
Chop shops stock chops.,,,,,,,,,,,,,,,,,,,
Chukotko-Kamchatkan,,,,,,,,,,,,,,,,,,,
Cinnamon aluminum linoleum.,,,,,,,,,,,,,,,,,,,
Clean clams crammed in clean cans.,,,,,,,,,,,,,,,,,,,
Click, clap, pluck, ...,,,,,,,,,,,,,,,,
Clowns grow glowing crowns.,,,,,,,,,,,,,,,,,,,
Colliding, colt riding cowboys, combining colliding while gliding at night coinciding in their fight. It wasn't quite trite even with slight sight, who was right? The fight like light, flashed bright, fast as bears bite flies flying near the bears eyes the fleeing flies die.,,,,,,,,,,,,,,
Come, come, Stay calm, stay calm, No need for alarm, It only hums, It doesn't harm.,,,,,,,,,,,,,
Come, come, Stay calm, stay calm, No need for alarm, It only hums, It doesn?ôt harm.,,,,,,,,,,,,,
Come kick six sticks quick.,,,,,,,,,,,,,,,,,,,
Comical economists.,,,,,,,,,,,,,,,,,,,
"Cook ""Cookie"" Turk took Kookie Kirk a turkey cookie.",,,,,,,,,,,,,,,,,,,
Corythosaurus bit the gory esophagus of the dillapitated Dilophosaurus who lived in the sorest of forests with the whacky pachy-rinosaurus and the ceratosaurus, but the most poorest and mourish panoplosaurus called Wang sang and rang chorus with the lurdusaurus and the brachiosaurus who was dying of staphylococus-aureas.,,,,,,,,,,,,,,,,,,
Courtney Dworkin,,,,,,,,,,,,,,,,,,,
Cows graze in groves on grass which grows in grooves in groves.,,,,,,,,,,,,,,,,,,,
Coy knows pseudonoise codes.,,,,,,,,,,,,,,,,,,,
Cracker rapper, cracker rapper, cracker rapper, ...,,,,,,,,,,,,,,,,
Craig Quinn?ôs quick trip to Crabtree Creek.,,,,,,,,,,,,,,,,,,,
Craig Quinn's quick trip to Crabtree Creek.,,,,,,,,,,,,,,,,,,,
Crash Quiche Course,,,,,,,,,,,,,,,,,,,
Crisp crusts crackle crunchily.,,,,,,,,,,,,,,,,,,,
Crush grapes, grapes crush, crush grapes.,,,,,,,,,,,,,,,,,
"Customer: Do you have soothers? Shopkeeper (thinking he had said ""scissors""): No", we don't have scissors. Customer: Soothers! Shopkeeper : No, we don't have scissors or soothers.,,,,,,,,,,,,,,,,,
Cuthbert?ôs cufflinks.,,,,,,,,,,,,,,,,,,,
Darla's dollars,,,,,,,,,,,,,,,,,,,
Darn dawn dog gone!,,,,,,,,,,,,,,,,,,,
De doorgaans dappere Durgerdammer drukker Dirk Doordraver die driemaal daags drieduims dikke dictionaires drukte doch door de dagelijkse druk dermate depressief doordraaide dat Dirk daaraan denkend daardoor dieptreurig de donkergrijze deur der drukkerij denderend dicht donderde. Dirk's drie dikke domme dochters dachten dat depressieve Dirk dagelijks drie deciliter drabbig dikke donkere druivensap dronk.,,,,,,,,,,,,,,,,,,,
Dear mother, give your other udder to my other brother.,,,,,,,,,,,,,,,,,,
Deer, deer, oh dear, oh dear, your career as a deer is over here no, no, oh no, although your career as a skellytun's begun.,,,,,,,,,,,,
Denise sees the fleece, Denise sees the fleas. At least Denise could sneeze and feed and freeze the fleas.,,,,,,,,,,,,,,,,,,
Dick had a dog, the dog dug, the dog dug deep, how deep did Dick's dog dig? Dick had a duck, the duck dived, the duck dived deep, how deep did Dick's duck dive? Dick's duck dived as deep as Dick's dog dug!,,,,,,,,,,,,,
Did Dick Pickens prick his pinkie pickling cheap cling peaches in an inch of Pinch or framing his famed French finch photos?,,,,,,,,,,,,,,,,,,,
Did Doug dig Dick's garden or did Dick dig Doug's garden?,,,,,,,,,,,,,,,,,,,
Dimensional analysis,,,,,,,,,,,,,,,,,,,
Does this shop sport short socks with spots?,,,,,,,,,,,,,,,,,,,
Don't spring on the inner-spring this spring or there will be an offspring next spring.,,,,,,,,,,,,,,,,,,,
Don't trouble trouble, until trouble troubles you! If you trouble trouble, triple trouble troubles you!,,,,,,,,,,,,,,,,,
Double bubble gum, bubbles double.,,,,,,,,,,,,,,,,,,
Dr. Johnson and Mr. Johnson, after great consideration, came to the conclusion that the Indian nation beyond the Indian Ocean is back in education because the chief occupation is cultivation.,,,,,,,,,,,,,,,,,
Drunk drugged ducks, Drunk drugged ducks, Drunk drugged ducks, ...,,,,,,,,,,,,,,,,
Dust is a disk's worst enemy.,,,,,,,,,,,,,,,,,,,
Each Easter Eddie eats eighty Easter eggs.,,,,,,,,,,,,,,,,,,,
East Fife Four, Forfar Five,,,,,,,,,,,,,,,,,,
Ed had edited it.,,,,,,,,,,,,,,,,,,,
Ed Nott was shot and Sam Shott was not. So it is better to be Shott than Nott. Some say Nott was not shot. But Shott says he shot Nott. Either the shot Shott shot at Nott was not shot, or Nott was shot. If the shot Shott shot shot Nott, Nott was shot. But if the shot Shott shot shot Shott, the shot was Shott, not Nott. However, the shot Shott shot shot not Shott - but Nott. So, Ed Nott was shot and that's hot! Is it not?,,,,,,,,,,,,,
Eddie edited it.,,,,,,,,,,,,,,,,,,,
Eleven benevolent elephants,,,,,,,,,,,,,,,,,,,
Elizabeth has eleven elves in her elm tree.,,,,,,,,,,,,,,,,,,,
Elizabeth?ôs birthday is on the third Thursday of this month.,,,,,,,,,,,,,,,,,,,
Elizabeth's birthday is on the third Thursday of this month.,,,,,,,,,,,,,,,,,,,
Elmer Arnold ,a Tudor who tooted the flute tried to tutor two tooters to toot. Said the two to the tutor," ""Is it harder to toot or to tutor two tooters to toot?""",,,,,,,,,,,,,,,,,
Ere her ear hears her err, here ears err here.,,,,,,,,,,,,,,,,,,
Esau Wood saw a wood saw, saw wood, as no wood saw would saw wood. If Esau Wood saw a wood saw, saw wood, as no wood saw would saw wood, where is the wood saw witch would saw wood, as no wood saw would saw wood.,,,,,,,,,,,,,
Esau Wood sawed wood. All the wood Esau Wood saw, Esau Wood would saw. All the wood Wood saw, Esau sought to saw. One day Esau Wood's wood-saw would saw no wood. So Esau Wood sought a new wood-saw. The new wood-saw would saw wood. Oh, the wood Esau Wood would saw. Esau sought a saw that would saw wood as no other wood-saw would saw. And Esau found a saw that would saw as no other wood-saw would saw. And Esau Wood sawed wood.,,,,,,,,,,,,,,,,
Everybody's heard of Peter Piper and the peck of pickled peppers that he picked. That's such a silly simple children's game. It hasn't even got a name. But I'd like to bet that it'll trip you and I bet you're gonna have to say you're licked. If Peter Piper you pronounce with ease, then twist your tongue around these. Moses supposes his toeses are roses, but Moses supposes erroneously. For Moses he knowses his toeses aren't roses, as Moses supposes his toeses to be. That's tongue twisters, and it seems so easy till the word gets sprung. If you insist you want to try a lisp, then step up mister and twist your tongue. Now Kissle will whistle at busty Miss. Russell who'll rustle and bustle till Kissle will roar. So Russell asked Axle for Kissle's dismissal and this'll teach Kissle to whistle no more. That's tongue twisters, and it seems so easy till you twist your tongue. Tito and Tato were tattooed in total, but Toto was only tattooed on his toe. So Tato told Tito where Toto was tattooed. But Tito said Toto's tattoo wouldn't show. Theda thought Thora was thumping her thimble. But Thomas thought Thora was thumping her drum said Theda if Thora's not thumping her thimble. I think that she surely is thumping her thumb. That's tongue twisters, and it seems so easy till the word gets sprung. If you insist you want to try a lisp, then step up mister and twist your tongue. Now Charley is chary when choosing his cheeses, and cheese is a challenge when Charley arrives. When Charley is charming and chooses a cheddar, then chews it and chips it and chops in some chives. Heda is hoping to hop to Tahiti to hack a hibiscus to hang on her hat. Now Heda has hundreds of hats on her hatrack, so how can a hop to Tahiti help that. Snobby Miss. Nora is sniffing her snuffer. The snuffer's no sniffing it makes Nora sneeze. When Snyda lets Nort know his Nora is sneezing, She snappily snorts Nora's sneezing a breeze. Sheila is selling her shop at the seashore. For shops at the seashore are so sure to lose. And she's not so sure of what she should be selling. Should Sheila sell seashells or should she sell shoes? That's tongue twisters and it seems so easy till the word gets sprung. If you insist you want to try a lisp, then step up mister and twist your tongue. Twista felt Twister was trying to whistle but Twister had twisted his tongue.,,,,,
Excited executioner exercising his excising powers excessively.,,,,,,,,,,,,,,,,,,,
Ex-disk jockey.,,,,,,,,,,,,,,,,,,,
Extinct insects' instincts, extant insects' instincts.,,,,,,,,,,,,,,,,,,
Faith's face cloth, Faith's face cloth, Faith's face cloth, ...,,,,,,,,,,,,,,,,
False Frank fled Flo Friday.,,,,,,,,,,,,,,,,,,,
Farrell's features fabulous food 'n' fantastic fountain fantasies for frolicking, fun-filled festive families.,,,,,,,,,,,,,,,,,,
Federal Express is now called FedEx. When I retire I?ôll be a FedEx ex. But if I?ôm an officer when I retire, I?ôll be an ex Fedex Exec. Then after a divorce, my ex-wife will be an ex FedEx exec?ôs ex. If I rejoin FedEx in time, I?ôd be an ex ex FedEx exec. When we remarry, my wife will be an ex ex FedEx exec?ôs ex.,,,,,,,,,,,,,,,
