So she bought a bit of butter, better than her bitter butter, and she baked it in her batter, and the batter was not bitter. So ?ôtwas better Betty Botter bought a bit of better butter.,,,,,,,,,,,,,,,,
Something in a thirty-acre thermal thicket of thorns and thistles thumped and thundered threatening the three-D thoughts of Matthew the thug ??although, theatrically, it was only the thirteen-thousand thistles and thorns through the underneath of his thigh that the thirty year old thug thought of that morning.,,,,,,,,,,,,,,,,,
Sounding by sound is a sound method of sounding sounds.,,,,,,,,,,,,,,,,,,,
Stagecoach stops.,,,,,,,,,,,,,,,,,,,
Strange strategic statistics.,,,,,,,,,,,,,,,,,,,
Strict strong stringy Stephen Stretch slickly snared six sickly silky snakes.,,,,,,,,,,,,,,,,,,,
Stupid Superstition,,,,,,,,,,,,,,,,,,,
Such a shapeless sash!,,,,,,,,,,,,,,,,,,,
Sunshine city, sunshine city, sunshine city, ...,,,,,,,,,,,,,,,,
Sunshine city, sunshine city, sunshine city,,,,,,,,,,,,,,,,,
Supposed to be pistachio, supposed to be pistachio, supposed to be pistachio.,,,,,,,,,,,,,,,,,
Sure, sir, the ship's sure shipshape, sir.,,,,,,,,,,,,,,,,
Sure the ship?ôs shipshape, sir.,,,,,,,,,,,,,,,,,,
Susan shineth shoes and socks; socks and shoes shines Susan. She ceased shining shoes and socks, for shoes and socks shock Susan.,,,,,,,,,,,,,,,,,,
Susie sits shinning silver shoes.,,,,,,,,,,,,,,,,,,,
Suzie, Suzie, working in a shoeshine shop. All day long she sits and shines, all day long she shines and sits, and sits and shines, and shines and sits, and sits and shines, and shines and sits. Suzie, Suzie, working in a shoeshine shop. Tommy, Tommy, toiling in a tailor?ôs shop. All day long he fits and tucks, all day long he tucks and fits, and fits and tucks, and tucks and fits, and fits and tucks, and tucks and fits. Tommy, Tommy, toiling in a tailor?ôs shop.,
Suzie Seaword?ôs fish-sauce shop sells unsifted thistles for thistle-sifters to sift.,,,,,,,,,,,,,,,,,,,
Suzie Seaword's fish-sauce shop sells unsifted thistles for thistle-sifters to sift.,,,,,,,,,,,,,,,,,,,
Swan swam over the sea. Swim, swan, swim! Swan swam back again. Well swum swan!,,,,,,,,,,,,,,,,,
Swan swam over the sea. Swim, swan, swim! Swan swam back again. Well swum, swan!,,,,,,,,,,,,,,,,
Swatch watch,,,,,,,,,,,,,,,,,,,
Sweater weather, leather weather.,,,,,,,,,,,,,,,,,,
Sweaty leather in wetty weather,,,,,,,,,,,,,,,,,,,
Sweet sagacious Sally Sanders said she sure saw seven segregated seaplanes sailing swiftly southward Saturday.,,,,,,,,,,,,,,,,,,,
Swift shift,,,,,,,,,,,,,,,,,,,
Switch watch, wrist watch.,,,,,,,,,,,,,,,,,,
Synonym cinnamon.,,,,,,,,,,,,,,,,,,,
Tell a tall tale of a tall tailed dog, that told Tim it tap a tall ale and thump the top of Tim's tomb.,,,,,,,,,,,,,,,,,,
Tell Tom the ticket taker to take the ticket to the ticket wicket.,,,,,,,,,,,,,,,,,,,
Ten tame tadpoles tucked tightly together in a thin tall tin.,,,,,,,,,,,,,,,,,,,
Terry Teeter, a teeter-totter teacher, taught her daughter Tara to teeter-totter, but Tara Teeter didn't teeter-totter as Terry Teeter taught her to.,,,,,,,,,,,,,,,,
Terry Teeter, a teeter-totter teacher, taught her daughter Tara to teeter-totter, but Tara Teeter didn?ôt teeter-totter as Terry Teeter taught her to.,,,,,,,,,,,,,,,,
Thank the other three brothers of their father?ôs mother?ôs brother?ôs side.,,,,,,,,,,,,,,,,,,,
That bloke?ôs back bike brake-block broke.,,,,,,,,,,,,,,,,,,,
The batter with the butter is the batter that is better!,,,,,,,,,,,,,,,,,,,
The big black bug bit the big black bear, but the big black bear bit the big black bug back!,,,,,,,,,,,,,,,,,,
The big black bug?ôs blood ran blue.,,,,,,,,,,,,,,,,,,,
The big black bug's blood ran blue.,,,,,,,,,,,,,,,,,,,
The black bloke?ôs back brake block broke.,,,,,,,,,,,,,,,,,,,
The bleak breeze blights the bright blue blossom,,,,,,,,,,,,,,,,,,,
The blue bluebird blinks.,,,,,,,,,,,,,,,,,,,
The bootblack bought the black boot back.,,,,,,,,,,,,,,,,,,,
The bottle of perfume that Willy sent was highly displeasing to Millicent. Her thanks were so cold that they quarreled, I'm told o'er that silly scent Willy sent Millicent,,,,,,,,,,,,,,,,,,
The cat catchers can?ôt catch caught cats.,,,,,,,,,,,,,,,,,,,
The cat crept into the crypt, crapped and crept out.,,,,,,,,,,,,,,,,,,
The CEO's colleagues trusted those successful clients although their results weren't less than lumpy!,,,,,,,,,,,,,,,,,,,
The chief of the Leith police dismisseth us.,,,,,,,,,,,,,,,,,,,
The children eat the chicken in the kitchen.,,,,,,,,,,,,,,,,,,,
The crow flew over the river with a lump of raw liver.,,,,,,,,,,,,,,,,,,,
The Doge did what a Doge does, when a Doge does his duty to a Duke, that is. When the Doge did his duty and the Duke didn't, that's when the Duchess did the dirt to the Duke with the Doge. There they were in the dark: The Duke with his dagger, the Doge with his dart and the Duchess with her dirk. The Duchess dug at the Duke just when the Duke dove at the Doge. Now the Duke ducked, the Doge dodged, and the Duchess didn't. So the Duke got the Duchess, the Duchess got the Doge, and the Doge got the Duke.,,,,,,,,,,,
The epitome of femininity.,,,,,,,,,,,,,,,,,,,
The ex-egg examiner.,,,,,,,,,,,,,,,,,,,
The fickle finger of fate flips fat frogs flat.,,,,,,,,,,,,,,,,,,,
The Final Fixing of the Foolish Fugitive feeling footloose, fancy-free and frisky, this feather-brained fellow finagled his fond father into forking over his fortune. Forthwith, he fled for foreign fields and frittered his farthings feasting fabulously with fair-weather friends. Finally, fleeced by those folly filled fellows and facing famine," he found him-self a feed flinger in a filthy farm-lot. He fain would have filled his frame with foraged food from fodder fragments. ""Fooey! My father's flunkies fare far fancier"," the frazzled fugitive fumed feverishly, frankly facing fact. Frustrated from failure and filled with forebodings, he fled for his family. Falling at his father's feet, he floundered forlornly. Father"," I have flunked and fruitlessly forfeited further family favors . . ."" But the faithful father", forestalling further flinching, frantically flagged his flunkies to fetch forth the finest fatling and fix a feast. But the fugitive's fault finding frater, faithfully farming his father's fields for free, frowned at this fickle forgiveness of former falderal. His fury flashed, but fussing was futile. His foresighted father figured," ""Such filial fidelity is fine", but what forbids fervent festivities? The fugitive is found! Unfurl the flags! With fanfare flaring, let fun, frolic and frivolity flow freely," former failures forgotten and folly forsaken."" Forgiveness forms a firm foundation for future fortitude.",,
The fuzzy bee buzzed the buzzy busy beehive.,,,,,,,,,,,,,,,,,,,
The great Greek grape growers grow great Greek grapes.,,,,,,,,,,,,,,,,,,,
The greedy Greek geek agreed.,,,,,,,,,,,,,,,,,,,
The hare?ôs ear heard ere the hare heeded.,,,,,,,,,,,,,,,,,,,
The king would sing, about a ring that would go ding.,,,,,,,,,,,,,,,,,,
The king would sing, about a ring that would go ding.How much dough would Bob Dole dole,,,,,,,,,,,,,,,,,,
The Knight said," ""He's""", with niceties," ""some nights a tease or nice at ease on nice settees"".",,,,,,,,,,,,,,,,
The Leith police dismisseth us They thought we sought to stay;  The Leith police dismisseth us They thought we'd stay all day. The Leith police dismisseth us, We both sighed sighs apiece;  And the sighs that we sighed as we said goodbye Were the size of the Leith police.,,,,,,,,,,,,,,,,,,
The little red lorry went down Limuru road.,,,,,,,,,,,,,,,,,,,
The minx mixed a medicinal mixture.,,,,,,,,,,,,,,,,,,,
The myth of Miss Muffet.,,,,,,,,,,,,,,,,,,,
The ochre ogre ogled the poker.,,,,,,,,,,,,,,,,,,,
The owner of the inside inn was inside his inside inn with his inside outside his inside inn.,,,,,,,,,,,,,,,,,,,
The owner of the Inside Inn Was outside his Instde Inn With his inside outside his Inside Inn.,,,,,,,,,,,,,,,,,,,
"The pellet with the poison's in the vessel with the pestle the chalice from the palace has the brew that is true. Later switched to: ""The pellet with the poison's in the flagon with the dragon. The vessel with the pestle has the brew that is true""",,,,,,,,,,,,,,,,,,,
The Professor Peter Peckinpah all purpose anti-personnel Peckinpah  pocket pistol under the toupee trick.,,,,,,,,,,,,,,,,,,,
The quack quit asking quick questions.,,,,,,,,,,,,,,,,,,,
The queen coined quick clipped quips.,,,,,,,,,,,,,,,,,,,
The queen in green screamed.,,,,,,,,,,,,,,,,,,,
The ruddy widow really wants ripe watermelon and red roses when winter arrives.,,,,,,,,,,,,,,,,,,,
The sawingest saw I ever saw saw was the saw I saw saw in Arkansas.,,,,,,,,,,,,,,,,,,,
The seething sea ceaseth; thus the seething sea sufficeth us.,,,,,,,,,,,,,,,,,,,
The seething seas ceaseth and twiceth the seething seas sufficeth us.,,,,,,,,,,,,,,,,,,,
The sinking steamer sank.,,,,,,,,,,,,,,,,,,,
The sixth shack's sixth sick sheik's sixth sheep 's sick.,,,,,,,,,,,,,,,,,,,
The sixth sheik?ôs sixth sheep?ôs sick.,,,,,,,,,,,,,,,,,,,
The sixth sick sheik?ôs sixth sheep?ôs sick.,,,,,,,,,,,,,,,,,,,
The sixth sick sheik's sixth sheep 's sick.,,,,,,,,,,,,,,,,,,,
The sixth sick sheik's sixth sick sheep.,,,,,,,,,,,,,,,,,,,
The sixth sick Sikh's sixth sheep is sick.,,,,,,,,,,,,,,,,,,,
The Smothers brothers' father's mother's brothers are the Smothers brothers' mother's father's other brothers.,,,,,,,,,,,,,,,,,,,
The soldier?ôs shoulder surely hurts!,,,,,,,,,,,,,,,,,,,
The soldier's shoulder surely hurts!,,,,,,,,,,,,,,,,,,,
The soldiers shouldered shooters on their shoulders.,,,,,,,,,,,,,,,,,,,
The sun shines on shop signs.,,,,,,,,,,,,,,,,,,,
The swan swam over the sea. Swim swan swim. The swan swam back again. Well swum, swan.,,,,,,,,,,,,,,,,,,
The third time the three three-toed tree toads tried tying their toes together, the third three-toed tree toad tied the two three-toed tree toads toes to the third toads toes. Then the two tied three-toed tree toads told the third three-toed tree toad that tying their toes together thrilled them to their toe tips.,,,,,,,,,,,,,,,,,,
The thirty-three thieves thought that they thrilled the throne throughout Thursday.,,,,,,,,,,,,,,,,,,,
The two-toed tree toad tried to tread where the three-toed tree toad trod.,,,,,,,,,,,,,,,,,,,
The two-twenty-two train tore through the tunnel.,,,,,,,,,,,,,,,,,,,
The winkle ship sank and the shrimp ship swam,,,,,,,,,,,,,,,,,,,
Their skis scare these.,,,,,,,,,,,,,,,,,,,
Thelma sings the theme song.,,,,,,,,,,,,,,,,,,,
Then a twister a-twisting will twist him a twist, For the twisting of his twist, he three twines doth intwist; But if one of the twines of the twist do untwist, The twine that untwisteth untwisteth the twist. Untwirling the twine that untwisteth between, He twirls, with his twister, the two in a twine; Then twice having twisted the twines of the twine, He twitcheth the twice he had twined in twain. The twain that in twining before in the twine, As twines were intwisted he now doth untwine; Twist the twain inter-twisting a twine more between, He, twirling his twister, makes a twist of the twine.,,,,,,,,
Theodore Thistle threw three thorny thistles. How many thorny thistles did Theodore Thistle throw?,,,,,,,,,,,,,,,,,,,
Theophiles Thistle, the successful thistle-sifter, in sifting a sieve full of un-sifted thistles, thrust three thousand thistles through the thick of his thumb. Now??.if Theophiles Thistle, the successful thistle-sifter, in sifting a sieve full of un-sifted thistles, thrust three thousand thistles through the thick of his thumb, see that thou, in sifting a sieve full of un-sifted thistles, thrust not three thousand thistles through the thick of thy thumb. Success to the successful thistle-sifter!,,,,,,,,,,
Theophilus Thadeus Thistledown, the succesful thistle-sifter, while sifting a sieve-full of unsifted thistles, thrust three thousand thistles through the thick of his thumb. Now, if Theophilus Thadeus Thistledown, the succesful thistle-sifter, thrust three thousand thistles through the thick of his thumb, see that thou, while sifting a sieve-full of unsifted thistles, thrust not three thousand thistles through the thick of thy thumb.,,,,,,,,,,
Theopholus Thistle, the successful thistle sifter, successfully sifted some thistles.,,,,,,,,,,,,,,,,,
There a plaice is pleased to be placed.,,,,,,,,,,,,,,,,,,,
There are two minutes difference from four to two to two to two, from two to two to two, too.,,,,,,,,,,,,,,,,,
There goes one tough top cop!,,,,,,,,,,,,,,,,,,,
There once was a man who had a sister, his name was Mr. Fister. Mr. Fister?ôs sister sold sea shells by the sea shore. Mr. Fister didn?ôt sell sea shells, he sold silk sheets. Mr. Fister told his sister that he sold six silk sheets to six shieks. The sister of Mr. Fister said I sold six shells to six shieks too!,,,,,,,,,,,,,,,,,
There once was a two toed, she toad, tree toad, and a three toed, he toad, tree toad??,,,,,,,,,,,,,,
There those thousand thinkers were thinking  where did those other three thieves go through.,,,,,,,,,,,,,,,,,,,
There those thousand thinkers were thinking how did the other three thieves go through.,,,,,,,,,,,,,,,,,,,
There was a fisherman named Fisher who fished for some fish in a fissure. ,,,,,,,,,,,,,,,,,,,
There was a fisherman named Fisher who fished for some fish in a fissure. Till a fish with a grin, pulled the fisherman in. Now they?ôre fishing the fissure for Fisher.,,,,,,,,,,,,,,,,,,
There was a little witch which switched from Chichester to Ipswich.,,,,,,,,,,,,,,,,,,,
There was a minimum of cinnamon in the aluminum pan.,,,,,,,,,,,,,,,,,,,
There was a writer called Wright," he taught his son to write Wright right:""It's not right to write Wright 'Rite'"," please try to write Wright right!""",,,,,,,,,,,,,,,,,
There was a young fisher named Fischer Who fished for a fish in a fissure. The fish with a grin, Pulled the fisherman in; Now they?ôre fishing the fissure for Fischer.,,,,,,,,,,,,,,,,,,
There was an old lady of Ryde Who ate some sour apples and died The apples fermented inside the lamented making cider inside ?òer insides,,,,,,,,,,,,,,,,,,,
There?ôs a sandwich on the sand which was sent by a sane witch.,,,,,,,,,,,,,,,,,,,
There's a cross on the muzzle of the pistol with the bullet, but a nick on the handle of the pistol with the blank.,,,,,,,,,,,,,,,,,,
There's a sandwich on the sand which was sent by a sane witch.,,,,,,,,,,,,,,,,,,,
They both, though, have thirty-three thick thimbles to thaw.,,,,,,,,,,,,,,,,,
They hatch fish at the state fish hatchery and sell hatched fish to the fish stick factory.,,,,,,,,,,,,,,,,,,,
They have left the thriftshop, and lost both their theatre tickets and the volume of valuable licenses and coupons for free theatrical frills and thrills.,,,,,,,,,,,,,,,,,,
They think that their teeth get thinner at times they want to taste thick meat.,,,,,,,,,,,,,,,,,,,
Thieves seize skis.,,,,,,,,,,,,,,,,,,,
Thin grippy thick slippery.,,,,,,,,,,,,,,,,,,,
Thin sticks, thick bricks,,,,,,,,,,,,,,,,,,
Thirty thrifty whistling washers witchingly whistling, wishing washing was washed.,,,,,,,,,,,,,,,,,,
Thirty-six thick silk threads,,,,,,,,,,,,,,,,,,,
Thirty-three thirsty, thundering thoroughbreds thumped Mr. Thurber on Thursday.,,,,,,,,,,,,,,,,,,
Thirty-three thousand feathers on a thrushes throat.,,,,,,,,,,,,,,,,,,,
Thirty-three thousand people think that Thursday is their thirtieth birthday.,,,,,,,,,,,,,,,,,,,
This is a zither.,,,,,,,,,,,,,,,,,,,
This is a zither. Is this a zither?,,,,,,,,,,,,,,,,,,,
This is the sixth zebra snoozing thoroughly.,,,,,,,,,,,,,,,,,,,
This is the sixth zebra snoozing thoroughly.,,,,,,,,,,,,,,,,,,,
Thomas Tattamus took two T's to tie two tots to two tall trees.,,,,,,,,,,,,,,,,,,,
Three free fleas flew freely through the flu.,,,,,,,,,,,,,,,,,,,
Three free throws.,,,,,,,,,,,,,,,,,,,
Three gray geese in the green grass grazing. Gray were the geese and green was the grass.,,,,,,,,,,,,,,,,,,,
Three grey geese in a green field grazing, grey were the geese and green was the grazing.,,,,,,,,,,,,,,,,,,
Three short sword sheaths.,,,,,,,,,,,,,,,,,,,
Three sweet switched Swiss witches watch three washed Swiss witch Swatch watch switches. Which sweet switched Swiss witch watches which washed Swiss witch Swatch watch switch?,,,,,,,,,,,,,,,,,,,
Three tired tigers try to throw three trees.,,,,,,,,,,,,,,,,,,,
Three Tree Turtles Three tree turtles took turns talking tongue twisters. If three tree turtles took turns talking tongue twisters, where's the twisters the three tree turtles talked?,,,,,,,,,,,,,,,,,,
Three tree turtles took turns talking tongue twisters. If three tree turtles took turns talking tongue twisters, where?ôs the twisters the three tree turtles talked?,,,,,,,,,,,,,,,,,,
Thrifty Theophilus, the theocratic thistle sifter, thrice thrust three thousand thistles through the slick thick of his softly throbbing thumb.,,,,,,,,,,,,,,,,,
Through three cheese trees three free fleas flew. While these fleas flew, freezy breeze blew. Freezy breeze made these three trees freeze. Freezy trees made these trees??cheese freeze. That?ôs what made these three free fleas sneeze.,,,,,,,,,,,,,,,,,,
Thrushcross Grange,,,,,,,,,,,,,,,,,,,
Tie a knot, tie a knot. Tie a tight, tight knot. Tie a knot in the shape of a nought.,,,,,,,,,,,,,,,,,
Tie twine to three tree twigs.,,,,,,,,,,,,,,,,,,,
Tie twine to three tree twigs.,,,,,,,,,,,,,,,,,,,
Till a fish with a grin, pulled the fisherman in. ,,,,,,,,,,,,,,,,,,
Tim, the thin twin tinsmith.,,,,,,,,,,,,,,,,,,
Tim the tool man tailor,,,,,,,,,,,,,,,,,,,
Tiny orangutan tongues!,,,,,,,,,,,,,,,,,,,
To begin to toboggan, first buy a toboggan. But don't buy too big a toboggan. Too big a toboggan is too big a toboggan to buy to begin to toboggan.,,,,,,,,,,,,,,,,,,
To begin to toboggan first, buy a toboggan. But do not buy too big a toboggan! Too big a toboggan is too big a toboggan to buy to begin to toboggan.,,,,,,,,,,,,,,,,,,
To put a pipe in byte mode, type PIPE_TYPE_BYTE.,,,,,,,,,,,,,,,,,,
To sit in solemn silence in a dull, dark dock, in a pestilential prison, with a life-long lock, awaiting the sensation of a short, sharp shock, from a cheap and chippy chopper on a big black block!,,,,,,,,,,,,,
To sit in solemn silence in a pestilential prison, and awaiting the sensation from a cheap and chippy chopper on a big black block!,,,,,,,,,,,,,,,,,,
To sit in solemn silence on a dull dark dock In a pestilential prison with a lifelong lock Awaiting the sensation of a short sharp shock From a cheap and chippy chopper on a big black block.,,,,,,,,,,,,,,,,,,,
Tom threw Tim three thumbtacks.,,,,,,,,,,,,,,,,,,,
Tommy, Tommy, toiling in a tailor's shop.,,,,,,,,,,,,,,,,,
Tommy, Tommy, toiling in a tailor's shop.,,,,,,,,,,,,,,,,,
Tommy, Tommy, toiling in a tailor?ôs shop. All day long he fits and tucks, all day long he tucks and fits, and fits and tucks, and tucks and fits, and fits and tucks, and tucks and fits. Tommy, Tommy, toiling in a tailor?ôs shop.,,,,,,,,,,
Tommy Tucker tried to tie Tammy?ôs Turtles tie.,,,,,,,,,,,,,,,,,,,
Tommy Tucker tried to tie Tammy's Turtles tie.,,,,,,,,,,,,,,,,,,,
Top chopstick shops stock top chopsticks.,,,,,,,,,,,,,,,,,,,
Toy boat, toy boat, toy boat, ...,,,,,,,,,,,,,,,,
Toy boat. Toy boat. Toy boat.,,,,,,,,,,,,,,,,,,,
Tragedy strategy.,,,,,,,,,,,,,,,,,,,
Trains lack lain track.,,,,,,,,,,,,,,,,,,,
Tricky Tristan tracked a trail of tiny turtles. How many tiny turtles did Tricky Tristan track? Tricky Tristan tracked twenty two tiny turtles; that's how many tiny turtles tricky Tristan tracked.,,,,,,,,,,,,,,,,,,,
Triple Dickle,,,,,,,,,,,,,,,,,,,
Truly rural, truly rural, truly rural, ...,,,,,,,,,,,,,,,,
Try fat flat flounders.,,,,,,,,,,,,,,,,,,,
Twelve standard stainless steel twin screw cruisers.,,,,,,,,,,,,,,,,,,,
Twelve twins twirled twelve twigs.,,,,,,,,,,,,,,,,,,,
Twice we tripped toys.,,,,,,,,,,,,,,,,,,,
Twitching, walking witches talking.,,,,,,,,,,,,,,,,,,
Two tiny tigers take two taxis to town.,,,,,,,,,,,,,,,,,,,
Two to two to Toulouse?,,,,,,,,,,,,,,,,,,,
Two toads, totally tired.,,,,,,,,,,,,,,,,,,
"Two tried and ""True tied""",,,,,,,,,,,,,,,,,,,
Two tried and true tridents,,,,,,,,,,,,,,,,,,,
Two Truckee truckers truculently truckling to have truck to truck two trucks of truck.,,,,,,,,,,,,,,,,,,,
Unique New York, unique New York, unique New York, ...,,,,,,,,,,,,,,,,
Unique New York,,,,,,,,,,,,,,,,,,,
United States twin-screw steel cruisers.,,,,,,,,,,,,,,,,,,,
Upper roller, lower roller, upper roller, lower roller, upper roller, lower roller, ...,,,,,,,,,,,,,
Upper roller, lower roller,,,,,,,,,,,,,,,,,,
Urgent detergent!,,,,,,,,,,,,,,,,,,,
V: Voil??! In view, a humble vaudevillian veteran, cast vicariously as both victim and villain by the vicissitudes of Fate. This visage, no mere veneer of vanity, is a vestige of the vox populi, now vacant, vanished. However, this valorous visitation of a by-gone vexation, stands vivified and has vowed to vanquish these venal and virulent vermin van-guarding vice and vouchsafing the violently vicious and voracious violation of volition. [carves V into poster on wall] V: The only verdict is vengeance; a vendetta, held as a votive, not in vain, for the value and veracity of such shall one day vindicate the vigilant and the virtuous. [giggles] V: Verily, this vichyssoise of verbiage veers most verbose, so let me simply add that it's my very good honor to meet you and you may call me V.,,,,,,
Valuble valley villas.,,,,,,,,,,,,,,,,,,,
Velvet Revolver, Velvet Revolver, Velvet Revolver, ...,,,,,,,,,,,,,,,,
Very rare vagrant wader,,,,,,,,,,,,,,,,,,,
Very well, very well, very well,,,,,,,,,,,,,,,,,
Vincent vowed vengence very vehemently.,,,,,,,,,,,,,,,,,,,
Wally Winkle wriggles his white, wrinkled wig.,,,,,,,,,,,,,,,,,,
Washing the washing machine while watching the washing machine washing washing.,,,,,,,,,,,,,,,,,,,
Washington's wash woman washed Washington's wash while Washington's wife went west.,,,,,,,,,,,,,,,,,,,
Wayne went to Wales to watch walruses.,,,,,,,,,,,,,,,,,,,
We need a plan to fan a pan; find a pan to fan, then find a fan to fan the pan, then fan the pan.,,,,,,,,,,,,,,,,,
We stand behind before we find what those behind be for.,,,,,,,,,,,,,,,,,,,
We surely shall see the sun shine soon.,,,,,,,,,,,,,,,,,,,
We will learn why her lowly lone, worn yarn loom will rarely earn immoral money.,,,,,,,,,,,,,,,,,,
We won, we won, we won, we won,,,,,,,,,,,,,,,,
We?ôre real rear wheels.,,,,,,,,,,,,,,,,,,,
We're real rear wheels.,,,,,,,,,,,,,,,,,,,
Wetter weather never weathered wetter weather better.,,,,,,,,,,,,,,,,,,,
What a shame such a shapely sash should such shabby stitches show.,,,,,,,,,,,,,,,,,,,
What a terrible tongue twister, what a terrible tongue twister, what a terrible tongue twister...,,,,,,,,,,,,,,,,,
What a terrible tongue twister, what a terrible tongue twister, what a terrible tongue twister??,,,,,,,,,,,,,,,,,
What did you have for breakfast? - rubber balls and liquor! What did you have for lunch? - rubber balls and liquor! What did you have for dinner? - rubber balls and liquor! What do you do when your sister comes home? - rubber balls and liquor!,,,,,,,,,,,,,,,,,,,
What noise annoys a noisy oyster? Any noise annoys a noisy oyster, but a noisy noise annoys a noisy oyster most!,,,,,,,,,,,,,,,,,,
What noise annoys an oyster most? A noisy noise annoys an oyster most.,,,,,,,,,,,,,,,,,,,
What to do to die today at a minute or two to two. A terribly difficult thing to say and a harder thing to do. A dragon will come and beat his drum Ra-ta-ta-ta-ta-ta-ta-ta-too at a minute or two to two today.  At a minute or two to two.,,,,,,,,,,,,,,,,,,,
What veteran ventriloquist whistles.,,,,,,,,,,,,,,,,,,,
What's a synonym for cinnamon or is cinnamon synonym-less?,,,,,,,,,,,,,,,,,,,
When a doctor doctors a doctor, does the doctor doing the doctoring doctor as the doctor being doctored wants to be doctored or does the doctor doing the doctoring doctor as he wants to doctor?,,,,,,,,,,,,,,,,,,
When a twister a-twisting will twist him a twist, For the twisting a twist, he three twines will entwist; But if one of the twines of the twist do untwist, The twine that untwisteth untwisteth the twist.,,,,,,,,,,,,,,,,
When I was in Arkansas I saw a saw that could outsaw any other saw I ever saw, saw. If you?ôve got a saw that can outsaw the saw I saw saw then I?ôd like to see your saw saw.,,,,,,,,,,,,,,,,,,
When I went to Warsaw, I saw a saw that could outsaw any saw that I ever saw. Now, if you go to Warsaw and see a saw that could outsaw the saw I saw, I'd like to see your saw saw.,,,,,,,,,,,,,,,,
When you write copy you have the right to copyright the copy you write,,,,,,,,,,,,,,,,,,,
When you write copy you have the right to copyright the copy you write. ... continued here,,,,,,,,,,,,,,,,,,,
Where she sits she shines, and where she shines she sits.,,,,,,,,,,,,,,,,,,
Where?ôs Squire?ôs spare wires?,,,,,,,,,,,,,,,,,,,
Whereat with blade, with bloody, blameful blade, he bravely broached his boiling bloody breast.,,,,,,,,,,,,,,,,
Whether the weather be fine or whether the weather be not. Whether the weather be cold or whether the weather be hot. We'll weather the weather whether we like it or not.,,,,,,,,,,,,,,,,,,,
Which rich wicked witch wished the wicked wish?,,,,,,,,,,,,,,,,,,,
Which Swiss witch switched the Swiss wristwatches?,,,,,,,,,,,,,,,,,,,
Which switch, Miss, is the right switch for Ipswich, Miss?,,,,,,,,,,,,,,,,
Which Witch snitched the Snitch Witch? Or did the Snitch Witch snitch the Witch? If the Snitch Witch snitched the Witch then which Witch did the Snitch Witch snitch?,,,,,,,,,,,,,,,,,,,
